,Title,Director,Cast,Genre,year
1935,Lajwanti,Hiralal Doctor,"Rattanbai, Anuradha, W. M. Khan, Ashiq Hussain, Fakir Mohammed",Social,1942
1936,Lalaji,"Chamankant Gandhi, Lalit Mehta","Yashodhara Katju, Krishnakant, Yakub, Amar, Maya Devi, Abdul Rehman Kabuli, Sunalini Devi, Jagdish Dethi, Badri Prasad, Vatsala Kumtekar",Social Drama,1942
1937,Mahakavi Kalidas,Niren Lahiri,"Karunu Bannerjee, Chhabi Biswas, Ulhas, Menaka Devi, Padma Devi",Biopic,1942
1938,Maheman a.k.a. Guest,Chaturbhuj Doshi,"Madhuri, Ishwarlal, Shamim, Rama Shukla, Kesari, Bhagwandas",Social,1942
1939,Malan,V. M. Vyas,"Shanta Hublikar, Rattanbai, Balwant Singh, Jagdish Sethi, But Kashar, Kalyani, Mirza Musharraf, Alaknanda,",Social,1942
1940,Mamaji,Narottam Vyas,"Lalita Pawar, Nandrekar, Yakub, Jeevan, Maruti, Misra, Nana Palsikar, Leela Pawar",Family Social,1942
1941,Mamta,I.A. Hafizji,"Prince Dara, Pushpa Rani, Kalawati, Padma Devi, Akbar, N. Mohammed, Puttan",Social,1942
1942,Mata,Gunjal,"Shobhana Samarth, Chandrakant, Mubarak, Urmila, Himalayawala, Munshi Khanjar, Bhudo Advani, Moti, Bibijan",Family Drama,1942
1943,Meenakshi,Modhu Bose,"Sadhona Bose, Ahindra Choudhury, Rajlakshmi Devi, K. C. Dey, Najmal Hussain, Devbala, Sandhya Rani, Priti Majumdar, Panna Devi",Romantic melodrama,1942
1944,Motorwali,A. M. Khan,"Radharani, Prakash, Ameena, Sardar Mansur, Nazira, Haroon, Ranibala, Anwaribai, Rafiq",Action,1942
1945,Muqabala,"Babubhai Mistri, Batuk Bhatt","Fearless Nadia, Yakub, Agha, Dalpat, Shrinivas, Rajni, Nazira, Jal Khambatta, Khan Mastana, Baby Madhuri",Double-role Action Drama,1942
1946,My Village a.k.a. Mera Gaon,Prafulla Roy,"Hansa Wadkar, P. Jairaj, K. C. Dey, Chhaya Devi, Amir Banu, S. L. Puri, Jagdish Sethi, Moti, Aghajani",Social,1942
1947,Nai Duniya,Abdul Rashid Kardar,"P. Jairaj, Shobhana Samarth, Wasti, Mazhar Khan, Hari Shivdasani, Jeevan, Ram Avtar, Azurie",Social,1942
1948,Nari,Raja Yagnik,"Trilok Kapoor, Lalita Pawar, Kamla Warekar, Anant Marathe, Urmila, Jilloobai, Ghulam Rasool",Social,1942
1949,Nazrana,G. P. Kapoor,"Mahipal, Anuradha, Lalita Devi, Ashiq Hussain, Jugal Kishore",Costume,1942
1950,Nishani,Roop K. Shorey,"Ragini, Majnu, Rooplekha, Ranibala, Ghulam Qadir",Social,1942
1951,Parda Nasheen,I. A. Hafizji,"Ram Dulari, Haseena, Girdhari, Nargis, Hanuman Prasad, Ganesh",Social,1942
1952,Phir Milenge,Sohrab Modi,"Sardar Akhtar, Sohrab Modi, Meena Shorey, K. N. Singh, Sadiq Ali, Athavale, Abu Bakar, E. Tarapore, Ghulam Hussain",Social,1942
1953,Pritam,Mohan Sinha,"Maya Banerji, Shyam Sunder, Shanti, Ghulam Rasool, Munshi Khanjar, Rajinder Singh",Social,1942
1954,Pyara Watan,M. Udwadia,"Benjamin, Alaknanda, Yashwant Dave, Samson, But Kashar, Kalyani",Costume Action,1942
1955,Raisaheb,S. M. Yusuf,"Trilok Kapoor, Kaushalya, Rattanbai, Gope, Dalpat, Mirza Musharraf, Jagdish Sethi, Kesarbai, Mustafa, Bibijan",Social,1942
1956,Raja Rani,Najam Naqvi,"Trilok Kapoor, Vanamala, Maya Devi, Sunalini Devi, Navin Yagnik, Mazhar Khan, David",,1942
1957,Return of Toofan Mail,Aspi Irani,"Arun, Shamim, Brijmala, Jagdish Sethi, Dixit, Hari Shivdasani, Mehdi Raza, Bibijan, Azurie, Rewashankar, Firoz Dastur",Action,1942
1958,Roti,Mehboob Akhtar,"Chandra Mohan, Akhtaribai Faizabadi, Sheikh Mukhtar, Sitara Devi, Ashraf Khan, Kayam Ali, Mirza, Nawab, Agha",Social,1942
1959,Sachcha Sapna,Madhav Kale,"Rajkumari, Madhav Kale, Kumar, Ashalata",Social,1942
1960,Saheli,S. M. Yusuf,"Pahari Sanyal, Rattanbai, Pramila, Jillobai, Rekha Devi, Aziz, Shahzadi, Sayed Ahmed",Social Drama,1942
1961,Sarovar Ki Sundari a.k.a. Lady of the Lake,A. M. Khan,"Romila, Zebunissa, Ameena, Prakash, Benjamin, N. A. Ansari, Rafique, Shhzadi, Anwaribai, Haroon, S. Alam","Action, Costume",1942
1962,Saugandh,Hemchandra Chunder,"Pahari Sanyal, Chhabi Biswas, Tulsi Chakraborty, Bharati Devi, Asit Baran, Dar Kashmiri, Jahar Ganguly, Nemo, Supriya Mukherjee, Puttan",Social,1942
1963,Savera,V.C. Desai,"Shobhana Samarth, Arun Kumar, Nirmala Devi, Yakub, Brijmala, Kesari, Nagendra, Kesari",Social,1942
1964,Sewa,Dhirubhai Desai,"Shanta Kumari, Zahur Raja, Shyam Sunder, Radharanu, Anwaribai, Prabhashankar",Social,1942
1965,Sharda,Abdul Rashid Kardar,"Mehtab, Ulhas, Nirmala Devi, Wasti, Badri Prasad, Amir Banu, Shyam Kumar","Drama, Family",1942
1966,Sheikh Chilli,Kikubhai Desai,"Moti, Navinchandra, Bose, Vasantrao Pehalwan, Kamala, Dhulia, S. L. Puri Ali, Azoorie, Bose",Comedy,1942
1967,Shobha,Kumarsen Samarth,"Shobhana Samarth, Shahu Modak, Karan Dewan, Sulochana Chatterjee, Mubarak, David, Kusum Deshpande, Jal Khambata, Vimal Sardesai",Social,1942
1968,Society,Nazir,"Sitara Devi, Nazir, Rajkumari Shukla, Gope, Alaknanda, Janardhan Sharma",Social,1942
1969,Station Master,Chimanlal Luhar,"Prem Adib, Kaushalya, Suraiya, Jagdish Sethi, Ratnamala, Amirbai Karnataki, Umakant, Gulab, Shakir, Pratima Devi, Jeevan",Social,1942
1970,Suhagan,Jagatrai Pesumal Advani,"Jehanara Kajjan, Kumar, Radharani, Kalyani Das, Jilloobai, Bhudo Advani, Kesarbai, Mirza Musharraf",Social Family Drama,1942
1971,Sukhi Jeevan,"Bhagwan, Harishchandra","Bhagwan, Ashalata, Harishchandra, Nazira, Bibijan, W. M. Khan, Shyam Kumar, Samson",Social,1942
1972,Swaminath,Wajahat Mirza,"Shobhana Samarth, Prem Adib, Keki Adajania, Majid, K. N. Singh, Bibjan, Jilloobai",Social,1942
1973,Swapna,Zia Sarhadi,"E. Billimoria, Kaushalya, Balwant Singh, Alaknanda, Bhudo Advani",Social,1942
1974,Tamanna,Phani Majumdar,"Nargis, Suraiya, P. Jairaj, Leela Desai, Karan Dewan, Jagdish Sethi, K C Dey, Shanta Kumari",Social,1942
1975,Tamasha,Dwarka Khosla,"Sardar Akhtar, Devaskar, W. M. Khan, Urmila Devi, Gope, Minoo Cooper, Samson",Social,1942
1976,Ujala,K. M. Multani,"Naseem Banu, Prithviraj Kapoor, Mubarak, Jillani, Rattanbai, Mirza Musharraf, Khan Mastana",Social,1942
1977,Uljhan,N.R. Acharya,"Sardar Akhtar, Mazhar Khan, Anjali Devi, Bhim, Amritlal, Rajkumari Shukla, Krishnakant Amir Banu",Social,1942
1978,Ulti Ganga,Keshavrao Dhaiber,"Paresh Bannerjee, E. Tarapore, Brijrani, Sadat Ali, Mehboob Khan, Gulab, Pramila, Abu Bakar, Athavale, Putlibai",Social,1942
1979,Vasantsena,Gajanan Jagirdar,"Gajanan Jagirdar, Shahu Modak, Vanamala, Sunalini Devi, Vimla Tripathi, E. Tarapore, Navin Yagnik, Raj Vishwas, Nazir Bedi",Drama,1942
1980,Vijay,Mohan Sinha,"Durga Khote, Harish, Husn Banu, N. A. Ansari, Maya Devi, Sankatha Prasad, Agha",Social,1942
1981,Yaad,Mazhar Khan,"Veena, Satish Batra, Mazhar Khan, Agha, Azurie, Shahzadi, Devaskar, Ram Avtar, Hadi",Social,1942
1982,Zamindar,Moti B. Gidwani,"Shanta Apte, Manorama, Ghulam Mohammed, Azmal, M. Esmail, S. D. Narang, Khairati, Durga Mota",Social,1942
1983,Zevar,K. Amarnath,"E. Bilimoria, Jayant, Indurani, Veena, Rajkumari, Jagan, Mirajkar, Badri Prasad, Rama Shukal",Action,1942
1984,Aabroo,Nazir,"Sitara Devi, Yakub, Masud, Nazir Ahmad, Chandabai, Laddan, Jagdish Sethi",Social,1943
1985,Aadab Arz,V.C. Desai,"Nalini Jaywant, Karan Dewan, Mukesh, Dulari",Social Drama,1943
1986,Aage Kadam,N.R. Acharya,"Motilal, Anjali Devi, Mubarak, Rajkumari Shukla, Padma Bannerji, Nand Kishore, Narmada Shankar",Social,1943
1987,Aankh Ki Sharm,Balwant Bhatt,"Prithviraj Kapoor, Trilok Kapoor, Kaushalya, Agha, Dalpat, Minakshi, Himalayawala, Nalini Gute, Nayampalli, Bibijan",Social,1943
1988,Amaanat,Lalit Chandra Mehta,"Harish, Husn Banu, Bhudo Advani, Sankatha Prasad, Agha, Dulari, Kayam Ali, Minakshi, Laddan, Nawab",Action,1943
1989,Andhera,Aspi Irani,"Sitara Devi, Arun Kumar, Kesari, Rajkumari, K C Dey, M. Bhagwandas, Baby Madhubala",Social Melodrama,1943
1990,Angoori,Mahesh Kaul,"Ulhas, Kaushalya, Sunetra, Angre, Dar Kashmiri",Social,1943
1991,Andhi Duniya,Produced by Zenith Pictures,"Nandrekar, Feroza Begum, B Yadav",Social,1943
1992,Angoothi,Bibhuti Mitra,"Ashok Kumar, Chandraprabha, Leela Mishra, S. Nair, Prahlad, Priti Majumdar",Social,1943
1993,Ashirwad,Ramchandra Thakur,"Lalita Pawar, Balwant Singh, Jilloobai, Rampyari, Vatsala Kumthekar, S. B. Nayampalli, Qayam Ali",Family Drama,1943
1994,Badalti Duniya,Mohan Sinha,"Mumtaz Shanti, Trilok Kapoor, K.C. Dey, Badri Prasad, Rajkumari Shukla",Social,1943
1995,Badla,Bhagwan,"Anjali Devi, Bhagwan, Devika, C. Ramchandra, Baburao Pehlwan, Raj Kamal",Action Drama,1943
1996,Bansari,Jayant Desai,"Ishwarlal, Urmila, Shamim, Noor Mohammed Charlie, Dixit, Bhagwan Das, Kesari",Social,1943
1997,Bhagta Bhoot,Ramanlal Desai,"Prakash, Madhurika, Baburao Pehalwan, Firoza Begum, Mumtaz Begum, Vasantrao Pehalwan, Brajrani, Amir Bano, Mirajkar",Action,1943
1998,Bhaichara,G.K. Mehta,"Bharat Bhushan, Sunetra, Ansari, Himmat Rai, Veena Kumari Hadi, Ramesh Sinha, Rajinder Singh",Social,1943
1999,Bhakta Raidas,Keshavrao Dhaiber,"Paresh Banerji, Anant Marathe, Sheela, K. N. Singh, Menka Lalita Pawar",Biopic Devotional,1943
2000,Bhaktaraj,Jayant Desai,"Vasanti, V. Padnis, Kaushalya, Mubarak, E. Billimoria, Dixit, Sheela, Bhagwan Das",Devotional,1943
2001,Bhalai,Nazir Ahmed Khan,"Prithviraj Kapoor, Sitara Devi, Mahajbin, Kumar, S. Nazir, Gope, Ranibala",Social,1943
2002,Chhed Chhad,K. Amarnath,"Sitara Devi, Nazir, Gope, Rajkumari, Majid",Social,1943
2003,Chhoti Maa a.k.a. Nurse,Chaturbhuj Doshi,"Khursheed, Anil Kumar, Arun Kumar, Prabha, Indira, Sheikh",Family Drama,1943
2004,Chirag,Ram Daryani,"Ishwarlal, Kaushalya, Gope, Veena Kumari, Gulab",Social,1943
2005,Duhai,V. M. Vyas,"Shanta Apte, Noor Jehan, Kumar, Zarina, Mirza Musharraf, Ansari, Kesarbai",Social,1943
2006,Dulhan,Gunjal,"Shahu Modak, Maya Banerji, Yashodara Katju, Rama Shukal, Rajkumari Shukla, Sankatha Prasad, Pesi Patel, Kanhaiyalal",Family Drama,1943
2007,Duniya Diwani,K. L. Khan,"Ramola, E. Billimoria, W. M. Khan, Firoza Begum, Samson, Bibijan",Social,1943
2008,Fashion,S.F. Hasnain,"Sardar Akhtar, Chandra Mohan, Kamta Prasad, S. Nazir, Sabita Devi. Bhudo Advani",Social,1943
2009,Gauri,Kidar Nath Sharma,"Monica Desai, Prithviraj Kapoor, Raj Kapoor, Rajkumari Shukla, Shamim, Kamla Chatterjee, Nagendra, Amarnath Pasan",Social,1943
2010,Hamari Baat,M. I. Dharmsey,"P. Jairaj, Devika Rani, Suraiya, Raj Kapoor, David, Shah Nawaz, Mumtaz Ali, Rajkumari Shukla",Social,1943
2011,Hospital a.k.a. Jogajog,Sushil Majumdar,"Kanan Devi, Jawahar, Ahindra Chowdhary, Hiralal, Krishnakant, Tulsi Chakraborty, Manorama",Social,1943
2012,Hunterwali Ki Beti,Batuk Bhatt,"Fearless Nadia, John Cawas, Sardar Mansur, Dalpat, Atish Sayani, Boman Shroff, Gulab",Action,1943
2013,Inkaar,Sudhir Sen,"Leela Desai, Pahari Sanyal, Swarnalata, Jagdish Sethi, Sunalini Devi, Shahadi, Agha, Putlibai, Ghulam Rasool",Social,1943
2014,Ishara,J.K. Nanda,"Prithviraj Kapoor, Suraiya, Swarnlata, K. N. Singh, Vatsala Kumtekar, Jagdish Sethi, Masood, Pratima Devi",Social,1943
2015,Jadui Jhoola,A. M. Khan,"Zebunnisa, Shiraz, Ameena, Vatsala Kumtekar, Rafiq, Ansari",Fantasy,1943
2016,Kanoon a.k.a. The Law,,"Shahu Modak, Mehtab, Badri Prasad",,1943
2017,Kashinath,Nitin Bose,"Asit Baran, Bharati Devi, Sunanda Bannerji, Dilip Bose, Manorama, Nawab Nemo, Radharani, Puttan",Social,1943
2018,Khazanchi Ki Beti,Nari Ghadiali,"Sharda, Yusuf Effendi, Majid, Shahadi, Dudha, Bibijan, Maqbul, Ghulam Hussain",Action,1943
2019,Khooni Laash,AR Kardar,"E. Billimoria, Shantarin, Baburao, Ali",Action Thriller,1943
2020,Kismet,Gyan Mukherjee,"Ashok Kumar, Mumtaz Shanti, Shah Nawaz, Mubarak, Chandraprabha, David, Kanu Roy, V. H. Desai",Drama,1943
2021,Koshish,Rafiq Rizvi,"Trilok Kapoor, Yakub, Husn Banu, Kalyani, Sunetra, Mirza Musharaf, Maste Nissar",Social,1943
2022,Kurbani,Ram Daryani,"Ishwarlal, Kaushalya, Vasanti, Durga Khote, Gope, Majid, Sheikh",Social,1943
2023,Ladaai Ke Baad,R. S. Junarrkar,"Shahu Modak, Raja Paranjpe, Snehprabha Pradhan, David, Kusum Deshpande, Sharda",Social,1943
2024,Love,Phani Majumdar,"Shanta Apte, Sunalini Devi, Narhari Narayan Joshi",,1943
2025,Mahasati Ansuya,V. M. Vyas,"Durga Khote, Shobhana Samarth, Shahu Modak, Gope, E. Billimoria, Rampyari",Devotional,1943
2026,Mahatma Vidur,Parshwanath Yeshwant Altekar,"Durga Khote, V. Pagnis, Raja Sandow, Nayampalli, Yashodhra Katju, David, Sita Jhaveri, Vasantrao Pehalwan, Kalyani Das",Devotional,1943
2027,Manchali,R.C. Talwar,"Ramola, Jyoti Prakash, Manorama, Sunder, Ram Dulari",Social,1943
2028,Masterji,Krishna Gopal,"Sardar Akhtar, Harish, Shah Nawaz, Bibijan, Veena, Leela Mishra, Shanti Patel, Syed Ahmed",Social,1943
2029,Mauj,"Batuk Bhatt, Babubhai Mistri","Pahari Sanyal, Kaushalya, Fearless Nadia, Sardar Mansur, Agha, Nazira",Social Action,1943
2030,Mazaaq,Zahur Raja,"Pahari Sanyal, Madhuri, Zahur Raja, Radharani, Haroon, Tara",Social,1943
2031,Mera Khwab,Hansraj Patel,"Prakash, Zebunissa, Samson, Putlibai, Abbas",Social,1943
2032,Mohabbat,Phani Majumdar,"Pahari Sanyal, Shanta Apte, Sunalini Devi, Jagdish Sethi, Manorama, K. C. Dey, S. Nair, Yashodara Katju, Navinchandra",Romance Drama,1943
2033,Mohabbat Ki Jeet,Ramanlal Desai,"Fearless Nadia, Navinchandra, S Nasir, Shakir, Agha, Leela Pawar, Narhari Narayan Joshi",Action,1943
2034,Mr. Jhatpat,Harbans,"Radharani, E. Billimoria, Harishchandra, Dalpat, Nazira, Devasker, Bibijan",Action,1943
2035,Muskurahat,"Ram Kamlani, Dwarka Khosla","Vanmala, Motilal, Hari Shivdasani, Ghory, Leela Mishra, Gope",Romance Drama,1943
2036,Nadaan,Zia Sarhadi,"Noor Jehan, Masood, Nazir Maya Devi, Murad, Alaknanda, Aman, Jilloobai",Social,1943
2037,Nagad Narayan,Vishram Bedekar,"Leela Desai, Kusum Deshpande, Pratima Devi, Baburao Pendharkar, Nayampalli, Masood, Rose, Shakir",Social,1943
2038,Nai Kahani,D.D. Kashyap,"Paresh Bannerjee, P. Jairaj, Rose, Nandrekar, Shalini, Chhotu, Rane",Social,1943
2039,Nai Zindagi,S. Khalil,"Sheikh Mukhtar, Anees Khatoon, Yakub, Nazma, Satish, Gope, Agha, Laddan",Social,1943
2040,Najma,Mehboob Khan,"Ashok Kumar, Veena, Kumar, Yakub, Sitara Devi, Majid, Agha, Murad, Rajkumari Shukla",Muslim social,1943
2041,Namaste,"M. Sadiq, S.U. Sunny","Protima Dasgupta, Wasti, Jagdish Sethi, Rajkumari Shukla, Misra, Allauddin S.B. Nayampalli",Social,1943
2042,Naukar,Syed Shaukat Hussain Rizvi,"Chandra Mohan, Shobhana Samarth, Noor Jehan, Yakub, Balwant Singh, Mirza Musharraf, Miss Moti",Social Melodrama,1943
2043,Naya Tarana,Najam Naqvi,"P. Jairaj, Snehprapha Pradhan, Raja Paranjpe, Pratima Devi, David, Chandrika, Sharda",Social,1943
2044,Naya Zamana,Nanubhai Vakil,"Sarojini, Rajnikant, Ghori, Benjamin, S. Nazir, Mehar Bano, Gulab, Munshi Khanjar, Rajnikant, Ghori",Drama,1943
2045,Paapi,Majnu,"Madhuri, Majnu, Salma, Zahur Shah, Satish Batra, Miss Iqbal",Social,1943
2046,Pagli,Shankar Mehta,"Aruna Devi, Kapoor, Asha, Ramesh, Roza, Mohini, Noor Mohammed Charlie",Social,1943
2047,Paigam,Surendra Desai,"Surendra, Sadhana Bose, Anil Kumar, Ansari, Sulochana Chatterjee, Hadi, Pratima Devi, Munshi Khanjar",Social,1943
2048,Panghat,"Mahesh Chandra, K.J. Parmar","Ratnamala, Umakant, Alaknanda, Jeevan, Leela Pawar, Sushil Kumar, M. Ismail, Jayant, Manorama",Social,1943
2049,Paraya Dhan,Nitin Bose,"Leela Desai, Balwant Singh, Maya Bannerjee, Jagdish Sethi, Sunalini Devi, Radharani, Rajkumari Shukla, Debi Mukherji, Baby Madhubala",Social Family Drama,1943
2050,Pistolwali,Nari Ghadiali,"Romila, Benjamin, Atish Sayani, Bibijan, Ali, Shahzadi, Amritlal Nagar",Action,1943
2051,Poonji,"Ravindra Dave, Vishnu Pancholi","Ragini, Ajmal, Jayant, Manorama, M. Ismail, Anwaribai",Social,1943
2052,Prarthana,Sarvottam Badami,"Motilal, Sabita Devi, Nimbalkar, Sadat Ali, Kajjan, K. N. Singh, Mehboob, Menka",Social,1943
2053,Pratiggya,Nandlal Jaswantlal,"Motilal, Swarnlata, Sunetra, Hari Shivdasani, Bhudo Advani, Baby Meena Kumari",Social,1943
2054,Prem Sangeet,Wahid-ud-din Zia-ud-din Ahmed,"P. Jairaj, Nina, Anwar, Rajkumari Shukla, W. M. Khan, Ram Avtar, H, Prakash, Gulab",Social,1943
2055,Prithvi Vallabh,Sohrab Modi,"Durga Khote, Sohrab Modi, Meena, K. Singh, Navin Yagnik, Latika, Sankatha Prasad, Sadiq Ali, Kajjan, Al Nasir, Shanta Kumari, Amirbai Karnataki",Historical Drama,1943
2056,Pyara Watan,M. Udwadia,"Alaknanda Benjamin, Yashwant Dave, Kalyani Das, But Kashar, Samson",Social,1943
2057,Rahgeer,A. Rashid,"Trilok Kapoor, Masood, Yakub, Zohra Sehgal, Shantarin, Shahzadi, Anwaribai, Habib",Social,1943
2058,Raja,Kishore Sahu,"Kishore Sahu, Protima Das Gupta, Moni Chatterjee, Ranibala, Ramesh Gupta, Anant Prabhu, Badri Prasad, Vijay Sahu, Gulab, Samson",Social,1943
2059,Ram Rajya,Vijay Bhatt,"Prem Adib, Shobhana Samarth Chandrakant, Badri Prasad, Shanta Kumari, Ranjana, Madhusudan, Umakant, Yashwant, Athavale",Religious,1943
2060,Rani,P.C. Barua,"P.C. Barua, Patience Cooper, Jamuna, Johar Ganguly, Kalavati, Bikram Kapoor",Social,1943
2061,Rekha,Mahendra Thakore,"Leela Chitnis, Harish, Maya Banerjee, Sankata Prasad, Padma Bannerji, Moni Chatterjee",Social,1943
2062,,Jagatrai Pesumal Advani,"Renuka Devi, S. D. Narang, Pran, Zahur Shah, Razia, Meena, Irshad",Social,1943
2063,,Nazir,"Ishwarlal, Sitara Devi, Yakub, Majid, Urmila, Anwari",Social,1943
2064,,Abdul Rashid Kardar,"Mehtab, Noor Mohammed Charlie, Anwar Hussain",,1943
2065,,Niranjan,"Mumtaz Shanti, Ulhas, Agha, Badri Prasad, Niranjan, Radharani, Habib",Social,1943
2066,,Chimanlal Luhar,"Karan Dewan, Gope, Sushil Kumar, Rajkumari Shukla, Jeevan, Maya Banerji, Kaushalya, M. Khanjar, Yakbal",Social,1943
2067,,G.R. Sethi,"Kumar, Vanmala, K. N. Singh, Husn Banu, M. Gupte, R. Roy, Bikram Kapoor, Leela Mishra",Historical Biopic Drama,1943
2068,,Chaturbhuj Doshi,"Arun Kumar, Mahipal, Sadhana Bose, Brijmala, Kamala Chatterjee, Narmada Shankar, Bhagwandas, Sulochana. Rewashankar, Rajinder Singh",Religious,1943
2069,,C. M. Trivedi,"Pahari Sanyal, Leela Desai, Moti, Agha, Jagdish Sethi, S. L. Puri, Ghulam Rasool",Social,1943
2070,,Debaki Bose,"Dhiraj Bhattacharya, Chhaya Devi, Tulsi Chakraborty, V. Panchotia, Bikram Kapoor, Biman Bannerji, Hiralal, Kamal Mitra",Devotional,1943
2071,,Jayant Desai,"K. L. Saigal, Khurshid, Mubarak, Kamla Chatterji, Nagendra, Kesari, Bhagwandas","Drama, Musical, Romance",1943
2072,,Mehboob Khan,"Motilal, Nargis, Chandra Mohan, Noor Mohammed Charlie, Jilloobai, Kayam Ali, Ansari, Laddan, Maheshar Shirazi",Romantic comedy,1943
2073,,Najam Naqvi,"Motilal, Swarnalata, Durga Khote, David, Azurie, Navin Yagnik, Devaskar, Nana Palsikar",Social,1943
2074,,Mohan Sinha,"Trilok Kapoor, Madhuri, Shahzadi, Rajkumari Shukla, Mumtaz Begum, Badri Prasad, Munshi Khanjar","Comedy, Drama",1943
2075,,G. S. Casshyap,"Motilal, Shobhana Samarth, Gope, David, Yashodhra Katju, Bhudo Advani, Leela Mishra, Mehar Bano",Social,1943
2076,,Kidar Sharma,"Prithviraj Kapoor, Sadhana Bose, Surendra, Kamla Chatterjee, Amarnath, Leela Mishra, Brijmala",Costume Fantasy,1943
2077,,Homi Wadia,"Surendra Trilok Kapoor, Mehtab, Sulochana Chatterjee, Gulab, Himalayawala, Nayampalli",,1943
2078,,Hemchandra Chunder,"Latika, Asit Baran, Dhiraj Bhattacharya, Bharati Devi, Nawab, Hiralal, Indu Mukerjee, Tulsi Chakraborty",Social,1943
2079,,Raja Yagnik,"Navinchandra, Leela Pawar, Agha, Dalpat, Sardar Mansur, Munshi Khanjar, Bhagwan Das",Action,1943
2080,,Jayant Desai,"Bhagwan, Ishwarlal, Kaushalya, Vatsala Kumtekar, Dixit",Drama,1943
2081,,Anand Kumar,"Khursheed, Biswas, Durga Khote, David, S. Nazir",Social,1943
2082,Aaina,S. M. Yusuf,"Trilok Kapoor, Sulochana Chatterjee, Yakub, Gope, Kaushalya, Yashodhra Katju, Husn Banu, Mirza Musharraf, Leela Mishra",Social,1944
2083,Anban,Niren Lahiri,"Nargis, Pahari Sanyal, Shah Nawaz, Shobhana Samarth, Gajanan Jagirdar, Mubarak",Social Drama,1944
2084,Bade Nawab Saheb,B. D. Vedi,"Chandra Mohan, Pramila, Pahari Sanyal, Bibbo, Kumar, Leela Mishra, Sushil Kumar, Shanta Patel, Ghory",Social,1944
2085,Badi Baat,Mazhar Khan,"Swarnalata, Mazhar Khan, Ulhas, Yakub, Zarina, Kumar, Gulab, Madhusudan",Social,1944
2086,Badmash,A. Karim,"Anil Kumar, Shantarin, Benjamin, Leela Pawar, Sadiq, Jehangir",Action,1944
2087,Bahadur,Bhagwan,"Bhagwan, Shanta Patel, Baburao Pendharkar, Surekha, Samson, Bibijan, Gharpure",Action,1944
2088,Bahar,M. Sadiq,"Mehtab, Wasti, Nirmala Devi, Badri Prasad",Social,1944
2089,Bandukwali,K. Amarnath,"S. Nazir, Romila, Anil Kumar, Rekha Pawar, Prakash, Mehar Banu",Action,1944
2090,Beda Paar,Tara Harish,"Sulochana Chatterjee, Dalpat, Bibjan, Baburao Pehalwan, Nazira, Fazlu, M. Sandow",Action,1944
2091,Bhagya Laxmi,Sarvottam Badami,"Shanta Apte, Prem Adib, Vasanti, Jagdish Sethi, Agha, Rajkumari Shukla, Moni Chatterjee",Family Drama,1944
2092,Bhai,Krishna Dev Mehra,"Zahur Raja, Asha, Satish, Radharani, Manorama, Sabir",Family Drama,1944
2093,Bhanvara,Kidar Sharma,"K. L. Saigal, Monica Desai, Yakub, Kamla Chatterjee, Arun Kumar, Kesari, Brijmala",Romance Comedy,1944
2094,Bhartrahari,Chaturbhuj Doshi,"Mumtaz Shanti, Surendra, Sulochana Chatterjee, Arun Kumar, Yashwant Dave, Jehanara Kajjan, Nagendra",Fantasy Devotional,1944
2095,Caravan,Aspi Irani,"Arun Kumar, Kamla Chatterjee, Kesari, Sylvie St. Clair, Premlata",Action,1944
2096,Chal Chal Re Navjavan,Gyan Mukherjee,"Ashok Kumar, Naseem Banu, Rafiq Ghaznvi, V. H. Desai, Jagdish Sethi, Motibai, Navin YagniK",Social,1944
2097,Chand,D.D. Kashyap,"Sitara Devi, Prem Adib, Begum Para, Sapru, Shashikala, Balakram, Guru Dutt, Ram Singh",Social,1944
2098,Char Aankhen,Sushil Majumdar,"Leela Chitnis, P. Jairaj, P. F. Peethawala, Ashalata, Paul Mahendra, Nand Kishore",Social,1944
2099,Dasi,Hiren Bose,"Najam, Ragini, Khairati, Kalavati, Om Prakash, Gyani Pran",Social,1944
2100,Dil Ki Baat,Pralhad Keshav Atre,"Ishwarlal, Vanmala, Durga Khote, Leela Mishra, Dixit, Baburao, Sheela, Mirajkar",Romantic Drama,1944
2101,Do or Die a.k.a. Zindagi Ya Maut,Harbans Singh,"Sheela, Baburao, Mirajkar, Samson",Action,1944
2102,Dost,Shaukat Hussain Rizvi,"Motilal, Noor Jehan, Maya Banerjee, Himalayawala, Husn Banu, Vatsala Kumtekar, Kanhaiyalal, Agha, Mirza Musharraf",Social Drama,1944
2103,Dr. Kumar,Kishore Sharma,"Paresh Bannerjee, Latika, Sankatha Prasad, Rajkumari Shukla, Khurshid Jr, Nazma",Drama,1944
2104,Draupadi,Baburao Patel,"Sushila Rani Patel, Chandra Mohan, Mazhar Khan",,1944
2105,Gaali,R. S. Choudhury,"Karan Dewan, Nirmala Devi, Yakub, Manju Dewan, Sunalini Devi, Kanhaiyalal, Jilloobai, Kamta Prasad, Mehndi Raza",Social Drama,1944
2106,Geet a.k.a. The Song,S. U. Sunny,"Shahu Modak, Nirmala Devi, Amir Ali, Shakir, Chandabai, Zahid Ali",Social,1944
2107,Ghar Ki Shobha,Harshadrai Sakerlal Mehta Ramesh Saigal,"Karan Dewan, Swarnalata, Yashodhra Katju, Dixit, Jagdish Sethi, Fazlu",Family Drama,1944
2108,Insaan,Babubhai Jani,"Kishore Sahu, Shobhana Samarth, Pahari Sanyal, David, Maya Banerjee, Krishna Chandra Dey, Nand Kishore",Social,1944
2109,Irada,M. Shamsuddin,"Dhiraj Bhattacharya, Patience Cooper, Shaida Keoravi, Purnima, Shyam Laha, Pushpa Rani",Social,1944
2110,Ismat,Sibtain Fazli,"Mehtab, Nargis, Nandrekar, Pratima Devi, Bhudo Advani, Irshad Ghory, Jani Babu",Social,1944
2111,Jadui Kismat,A. M. Khan,"Shanta Patel, Shiraz, Mehar Bano, Nawaz, Anwaribai, Sultan Baba",Action,1944
2112,Jeevan,M. Sadiq,"Mehtab, Wasti, Nirmala Devi, Badri Prasad, Misra, Shyam Kumar",Social,1944
2113,Jwar Bhata,Amiya Chakravarty,"Dilip Kumar, Mridula Rani, Shamim Bano, Agha, Bikram Kapoor, K. N. Singh, Khalil, Mumtaz Ali",Drama,1944
2114,Kadambari,Nandlal Jaswantlal,"Vanmala, Shanta Apte, Pahari Sanyal, Harish, Jeevan, Jagdish Sethi",Costume,1944
2115,Kaliyan,Kidar Sharma,"Motilal, Leela Desai, Ramola, Amarnath, Sulochana Chatterjee, Leela Mishra, Rajinder Singh",Social,1944
2116,Kavita,"K. J. Parmar, Mahesh Chander","Ratnamala, Umakant, Jeevan, Kanta Kumari, Badri Prasad, Athavale",Social,1944
2117,Kiran,Gajanan Jagirdar,"Ashok Kumar, Leela Chitnis, Jagirdar, Kanhaiyalal, Kusum Deshpande, Rama Shukal, Rajkumari Shukla, Nand Kishore",Social,1944
2118,Kismatwala,Nanubhai Vakil,"Prakash, Urmila, Navin Yagnik, Himalayawala, Vatsala Kumtekar, Narmada Shankar, Geeta Sardesai",Action,1944
2119,Krishna Bhakta Bodana,JBH Wadia,"Sheikh Mukhtar, Ranjit Kumari, Gope, Badri Prasad, Meera, Rani Premlata, Gulab, S.B. Nayampalli",Devotional,1944
2120,Lady Doctor,Wali Saheb,"Mumtaz Shanti, Sajjan, Ulhas, Mubarak, Maya Bannerjee, David, Nandrekar",Social,1944
2121,Laheri Badmash,Nari Ghadiali,"Husnara, Yusuf Effendi, Bibijan, Mannan, Putlibai, Mohammed Hussain, Mohammed Sandow",Action,1944
2122,Laheri Cameraman,Nari Ghadiali,"Benjamin, Shantarin, Agha, Bibijan, Nazira, Sadiq, Munchi Tuthi",Action,1944
2123,Lal Haveli,K.B. Lall,"Noor Jehan, Surendra, Yakub, Ulhas, Baby Meena Kumari, Maya Bannerjee, Kanhaiyalal, Vatsala Kumtekar, Ghory, Badri Prasad",Social Family Drama,1944
2124,Lalkar,Jayant Desai,"Ramola, Ishwarlal, Maya Bannerjee, Mubarak",Social,1944
2125,Lieutenant,Nari Ghadiali,"Sharda, Benjamin, Bibijan, Sandow, Nazira, Putlibai, Shahzadi",Action,1944
2126,Maa Baap,V. M. Vyas,"Veena, Nazir, Yakub, Majeed, Amirbai Karnataki, Dixit, Jagdish, Rajkumari Shukla",Social Family Drama,1944
2127,Maharathi Karna,Bhalji Pendharkar,"Prithviraj Kapoor, Swarnalata, Durga Khote, Shahu Modak, Kamalakar Torne, K. N. Singh, Nimbalkar, Vasantrao Pehalwan","Action, Adventure, Drama, War",1944
2128,Mali,V. Shantaram,"Mahipal, Nana Palsikar, Amirbai Karnataki",Devotional,1944
2129,Man Ki Jeet,Wahid-ud-din Zia-ud-din Ahmed (W. Z. Ahmed),"Nina, Shyam, Tiwari, Rajkumari Shukla, Prakash, Saroj Borkar, Gulab",Social,1944
2130,Manorama,Jayant Desai,"Ishwarlal, Leela Chitnis, Maya Banerjee, Mubarak, Noor Mohammad Charlie, Alaknanda, Naseem Jr.",Social,1944
2131,Mauji Jeevan,Poonawala,"Sulochana Chatterjee, Harishchandra, Nazira, Ghory, Bibijan, Dalpat, Habib, Devaskar",Action,1944
2132,Maya Nagari,Dhirubhai Desai,"Prakash, Rajkumari, Yashwant Dave, Shahzadi, Samson, Fazlu",Fantasy,1944
2133,Meena,Phani Majumdar,"Hansa Wadkar, Vasanti, Dixit, Shashi Kapoor, Shakir, Ratan Piya",Social,1944
2134,Meri Bahen a.k.a. My Sister,Hemchandra Chunder,"K. L. Saigal, Tulsi Chakraborty, Chandrabati Devi, Sumitra Devi, Nawab, Akhtar Jehan, Hiralal, Tandon",Family Social,1944
2135,Miss Devi,C. M. Trivedi,"Surendra, Leela Desai, Nazir, Moni Chatterjee, Jagdish, Agha",Social,1944
2136,Mujrim,Nitin Bose,"Motilal, Leela Desai, Yakub, Jagdish Sethi, Veena, Sunalini Devi, S. Nazir, Cuckoo",Social,1944
