,Title,Director,Cast,Genre,year
7001,Jai Maa Karwa Chauth,Pradeep Pandit,"Master Ankit, Banjara, Kishore Anand Bhanushali","Drama, Fantasy, History",1994
7002,Janam Se Pehle,B.R. Ishara,"Raj Babbar, Farah Naaz, Sumeet Saigal",,1994
7003,Janta Ki Adalat,T.L.V. Prasad,"Sadashiv Amrapurkar, Asrani, Laxmikant Berde",Musical,1994
7004,Jazbaat,Anant Balani,"Suchitra Krishnamoorthi, Rohit Roy, Reema Lagoo",Romance,1994
7005,Juaari,Jagdish A. Sharma,"Dharmendra, Arman Kohli, Shilpa Shirodkar",Family,1994
7006,Kabhi Haan Kabhi Naa,Kundan Shah,"Shah Rukh Khan, Naseeruddin Shah, Suchitra Krishnamoorthi",Romance,1994
7007,Kanoon,Sushma Shiromani,"Ajay Devgn, Urmila Matondkar, Kiran Kumar, Gulshan Grover",Action,1994
7008,Karan,Shiv Kumar,"Vindu Dara Singh, Prem Chopra, Trishna",,1994
7009,Khudai,Johny Bakshi,"Rajesh Khanna, Madhavi, Deepika Chikhalia",Drama,1994
7010,Khuddar,Iqbal Durrani,"Govinda, Karishma Kapoor",Action,1994
7011,Kranti Kshetra,Raajiv Kumar,"Mithun Chakraborty, Pooja Bhatt, Harish Kumar",Action,1994
7012,Krantiveer,Mehul Kumar,"Nana Patekar, Dimple Kapadia, Atul Agnihotri, Mamta Kulkarni","Drama, Romance",1994
7013,Laadla,Raj Kanwar,"Anil Kapoor, Sridevi, Raveena Tandon",Drama,1994
7014,Laqshya,Bhagwan Thakur,"Tinnu Anand, Kiran Kumar, Sujit Kumar",,1994
7015,Madam X,Deepak Shivdasani,"Rekha, Mohsin Khan, Shakti Kapoor","Action, Crime, Drama, Thriller",1994
7016,Madhosh,Vikram Bhatt,"Dilip Dhawan, Anjali Jatthar, Faisal Khan",,1994
7017,Maha Shaktishaali,K. Pappu,"Dharmendra, Ayesha Jhulka, Anupam Kher",,1994
7018,Main Khiladi Tu Anari,Sameer Malkan,"Akshay Kumar, Saif Ali Khan, Shilpa Shetty, Raageshwari","Action, Comedy",1994
7019,Mammo,Shyam Benegal,"Farida Jalal, Surekha Sikri, Amit Phalke",Drama,1994
7020,Mera Pyara Bharat,Rama Rao Tatineni,"Tisca Chopra, Puneet Issar, Sharad S. Kapoor",Action,1994
7021,Mohabbat Ki Arzoo,K.C. Bokadia,"Rishi Kapoor, Zeba Bakhtiar, Rakesh Bedi, Ashwini Bhave","Action, Romance, Drama",1994
7022,Mohra,Rajiv Rai,"Sunil Shetty, Naseeruddin Shah, Akshay Kumar, Raveena Tandon, Paresh Rawal",Action,1994
7023,Mr. Azaad,T. Ramarao,"Anil Kapoor, Niki Aneja, Ishrat Ali","Action, Musical",1994
7024,Naaraaz,Mahesh Bhatt,"Mithun Chakraborty, Pooja Bhatt, Sonali Bendre, Atul Agnihotri","Action, Crime, Drama",1994
7025,Paramaatma,Bapu,"Mithun Chakraborty, Juhi Chawla, Amrish Puri","Action, Drama, Fantasy",1994
7026,Pathreela Raasta,Ajay Kashyap,"Dimple Kapadia, Varsha Usgaonkar, Sadashiv Amrapurkar",Action,1994
7027,Pehla Pehla Pyar,Manmohan Singh,"Rishi Kapoor, Tabu, Anupam Kher","Drama, Crime, Action, Comedy",1994
7028,Prem Shakti,Shibu Mitra,"Govinda, Karisma Kapoor, Shakti Kapoor","Action, Drama, Fantasy, Romance",1994
7029,Prem Yog,Rajeev Kumar,"Rishi Kapoor, Madhoo, Shammi Kapoor","Drama, Family",1994
7030,Pyar Ka Rog,,"Ravi Behl, Bindu","Comedy, Romance",1994
7031,Raat Ke Gunaah,,"Archana Singh, Shekhar Suman",,1994
7032,Raja Babu,David Dhawan,"Govinda, Karishma Kspoor, Shakti Kapoor, Kader Khan, Prem Chopra, Gulshan Grover",Comedy,1994
7033,Saajan Ka Ghar,Surendra Kumar Bohra,"Rishi Kapoor, Juhi Chawla, Deepak Tijori","Drama, Family",1994
7034,Saboot Mangta Hain Kanoon,Suraj Prakash,"Raj Babbar, Shashi Kapoor, Amjad Khan, Anita Raj",Action,1994
7035,Salaami,Shahrukh Sultan,"Ayub Khan, Samyukta, Roshini Jaffery",Adventure,1994
7036,Sangdil Sanam,Shomu Mukerji,"Salman Khan, Manisha Koirala",,1994
7037,Sholay Aur Toofan,N. Paryani,"Kiran Kumar, Raaj Premi, Damini Priya",,1994
7038,Stuntman,Deepak Balraaj Vij,"Jackie Shroff, Avtar Singh Ahluwalia, Tinnu Anand, Ami Asthana","Action, Drama, Romance",1994
7039,Suhaag,Kuku Kohli,"Ajay Devgn, Akshay Kumar, Nagma, Karisma Kapoor",Action,1994
7040,Teesra Kaun?,Partho Ghosh,"Mithun Chakraborty, Chunky Pandey, Somy Ali","Comedy, Drama, Thriller",1994
7041,Tejasvini,N. Chandra,"Deepak Malhotra, Vijayshanti, Charan Raj","Action, Drama, Family",1994
7042,Thanedarni,Surinder Kapoor,Shikha Swaroop,,1994
7043,The Gentleman,Mahesh Bhatt,"Juhi Chawla, Chiranjeevi",Action,1994
7044,Triyacharitra,Basu Chatterjee,"Om Puri, Rajeshwari Sachdev, Naseeruddin Shah",Drama,1994
7045,Two Brothers,,Juhi Chawla,,1994
7046,Udhaar Ki Zindagi,K.V. Raju,"Jeetendra, Moushumi Chatterjee, Kajol",,1994
7047,Ulfat Ki Nayee Manzilen,K. Ravi Shankar,"Agha, Ramesh Deo, Seema Deo",,1994
7048,Vaade Iraade,Kalpana Bhardwaj,"Aayuush Kumar, Mamta Kulkarni, Kulbhushan Kharbanda",Social,1994
7049,Vayu,Velu Viswanandhan,,,1994
7050,Vijaypath,Farogh Siddique,"Ajay Devgn, Tabu, Suresh Oberoi","Romance, Drama",1994
7051,Woh Chokri,Subhankar Ghosh,"Pallavi Joshi, Neena Gupta",Drama,1994
7052,Yaar Gaddar,Umesh Mehra,"Saif Ali Khan, Shweta, Somy Ali",,1994
7053,Yeh Dillagi,Naresh Malhotra,"Akshay Kumar, Saif Ali Khan, Kajol",Romance,1994
7054,Yuhi Kabhi,Kumar Bhatia,"Tinnu Anand, Master Bhagwan, Kumar Bhatia","Comedy, Drama",1994
7055,Zaalim,Sikander Bharti,"Akshay Kumar, Madhoo",Action,1994
7056,Zakhmi Dil,Raju Subramanian,"Akshay Kumar, Ashwini Bhave, Ravi Kishan","Action, Romance",1994
7057,Zamane Se Kya Darna,Bobby Raj,"Sanjay Dutt, Raveena Tandon, Alok Nath",Family,1994
7058,Zid,Esmayeel Shroff,"Jay Mehta, Raageshwari, Mala Sinha",,1994
7059,,,,,1994
7060,Dilwale Dulhania Le Jayenge,,,,1995
7061,Karan Arjun,,,,1995
7062,Raja,,,,1995
7063,Rangeela,,,,1995
7064,Barsaat,,,,1995
7065,Coolie No. 1,,,,1995
7066,Sabse Bada Khiladi,,,,1995
7067,Trimurti,,,,1995
7068,Ram Jaane,,,,1995
7069,Akele Hum Akele Tum,,,,1995
7070,Guneghar,Vikram Bhatt,"Atul Agnihotri, Pooja Bhatt",,1995
7071,Ab Insaf Hoga,Harish Shah,"Vikas Anand, Sahila Chaddha, Mithun Chakraborty",,1995
7072,Karan Arjun,Rakesh Roshan,"Salman Khan, Shah Rukh Khan, Kajol, Mamta Kulkarni, Raakhee Gulzar, Amrish Puri, Ranjeet",Action,1995
7073,Jawab,Ajay Kashyap,"Raaj Kumar, Harish Kumar, Karishma Kapoor, Prem Chopra, Mukesh Khanna",,1995
7074,,,,,1995
7075,Andolan,Aziz Sejawal,"Sanjay Dutt, Govinda, Mamta Kulkarni, Somy Ali",Comedy,1995
7076,Surakshaa,Raju Mavani,"Sunil Shetty, Aditya Pancholi, Saif Ali Khan, Divya Dutta, Monica Bedi",,1995
7077,Naajayaz,Mahesh Bhatt,"Naseeruddin Shah, Ajay Devgn, Juhi Chawla","Action, Thriller",1995
7078,Baazi,Ashutosh Gowarikar,"Aamir Khan, Mamta Kulkarni",Action,1995
7079,Maidan-E-Jung,K. C. Bokadia,"Akshay Kumar, Karisma Kapoor",,1995
7080,The Don,Farogh Siddique,"Mithun Chakraborty, Sonali Bendre",Action,1995
7081,Prem,Satish Kaushik,"Sanjay Kapoor, Tabu, Deepak Tijori","Romance, Drama",1995
7082,Droh Kaal,Govind Nihalani,"Om Puri, Naseeruddin Shah, Mita Vasisht","Crime, Drama",1995
7083,Bewafa Sanam,Gulshan Kumar,"Krishna Kumar, Shilpa Shirodkar, Sagar",,1995
7084,Taqdeerwala,K. Muralimohana Rao,"Venkatesh, Raveena Tandon, Asrani","Fantasy, Action, Comedy",1995
7085,Janam Kundli,Tariq Shah,"Jeetendra, Vinod Khanna, Reena Roy","Action, Drama",1995
7086,Policewala Gunda,Pappu Verma,"Dharmendra, Reena Roy, Mamta Kulkarni",Crime,1995
7087,Raghuveer,K. Pappu,"Sunil Shetty, Shilpa Shirodkar",,1995
7088,Sabse Bada Khiladi,Umesh Mehra,"Akshay Kumar, Mamta Kulkarni, Mohnish Behl","Action, Masala",1995
7089,Gaddaar,Deepak Sareen,"Sunil Shetty, Harish Kumar, Sonali Bendre",,1995
7090,Raja,Indra Kumar,"Sanjay Kapoor, Madhuri Dixit, Paresh Rawal, Mukesh Khanna, Dalip Tahil","Action, Romance, Drama",1995
7091,Ravan Raaj: A True Story,T. Rama Rao,"Aditya Pancholi, Mithun Chakraborty, Madhoo, Sheeba, Paresh Rawal",Action,1995
7092,Taaqat,Talat Jani,"Dharmendra, Shatrughan Sinha, Kajol, Farah Naaz, Vikas Bhalla","Romance, Crime",1995
7093,Coolie No. 1,David Dhawan,"Govinda, Karishma Kapoor, Kader Khan, Shakti Kapoor",Comedy,1995
7094,,,,,1995
7095,Takkar,Bharat Rangachary,"Naseeruddin Shah, Sunil Shetty, Sonali Bendre","Romance, Thriller",1995
7096,Zamana Deewana,Ramesh Sippy,"Jeetendra, Shatrughan Sinha, Shahrukh Khan, Raveena Tandon",Comedy,1995
7097,Criminal,Mahesh Bhatt,"Akkineni Nagarjuna, Manisha Koirala, Ramya Krishna, Nassar, Gulshan Grover, Sharat Babu","Action, Thriller",1995
7098,Aatank Hi Aatank,Dilip Shankar,"Aamir Khan, Juhi Chawla","Action, Crime",1995
7099,Hulchul,Anees Bazmee,"Vinod Khanna, Ajay Devgn, Kajol, Amrish Puri",Action,1995
7100,Oh Darling! Yeh Hai India,Ketan Mehta,"Shahrukh Khan, Deepa Sahi, Jaaved Jaffrey","Musical, Parody",1995
7101,Guddu,Prem Lalwani,"Shahrukh Khan, Manisha Koirala, Deepti Naval, Mukesh Khanna, Mehmood Ali","Romance, Drama",1995
7102,Hum Dono,Shafi Inamdar,"Rishi Kapoor, Nana Patekar, Pooja Bhatt",,1995
7103,Ahankaar,Ashim S. Samanta,"Mithun Chakraborty, Mamta Kulkarni, Mohnish Bahl, Prem Chopra",,1995
7104,Veer,Kanti Shah,"Ishrat Ali, Dharmendra, Gautami",,1995
7105,Rangeela,Ram Gopal Varma,"Aamir Khan, Urmila Matondkar, Jackie Shroff","Romance, Comedy",1995
7106,Gundaraj,Guddu Dhanoa,"Ajay Devgn, Kajol, Amrish Puri",Action,1995
7107,Jallaad,T. L. V. Prasad,"Mithun Chakraborty, Madhoo, Rambha",Action,1995
7108,Kartavya,Raj Kanwar,"Sanjay Kapoor, Juhi Chawla, Aruna Irani",Action,1995
7109,Veergati,K.K. Singh,"Salman Khan, Atul Agnihotri Divya Dutta",Action,1995
7110,Barsaat,Rajkumar Santoshi,"Bobby Deol, Twinkle Khanna, Mukesh Khanna",Romance,1995
7111,Dilwale Dulhania Le Jayenge,Aditya Chopra,"Shahrukh Khan, Kajol, Amrish Puri, Farida Jalal, Anupam Kher, Mandira Bedi",Romance,1995
7112,Yaraana,David Dhawan,"Rishi Kapoor, Madhuri Dixit, Raj Babbar, Kader Khan, Shakti Kapoor",Romance,1995
7113,Hum Sab Chor Hain,Ambrish Sangal,"Kamal Sadanah, Dharmendra, Jeetendra, Ritu Shivapuri, Sujata Mehta",Action,1995
7114,Ram Shastra,Sanjay Gupta,"Jackie Shroff, Manisha Koirala, Dipti Bhatnagar",Action,1995
7115,Angrakshak,Ravi Raja,"Sunny Deol, Pooja Bhatt, Kulbhushan Kharbanda",Action,1995
7116,Akele Hum Akele Tum,Mansoor Khan,"Aamir Khan, Manisha Koirala, Tanvi Azmi",Drama,1995
7117,Ram Jaane,Rajiv Mehra,"Shahrukh Khan, Juhi Chawla, Vivek Mushran","Crime, Drama",1995
7118,The Gambler,Dayal Nihalani,"Govinda, Shilpa Shetty, Aditya Pancholi, Gulshan Grover",Action,1995
7119,Trimurti,Mukul S. Anand,"Anil Kapoor, Shah Rukh Khan, Jackie Shroff, Priya Tendulkar, Gautami, Anjali Jathar","Action, Drama",1995
7120,Haqeeqat,Kuku Kohli,"Ajay Devgn, Tabu, Aruna Irani",,1995
7121,Aatank Hi Aatank,Dilip Shankar,"Rajinikanth, Aamir Khan, Juhi Chawla","Crime, Romance",1995
7122,Aazmayish,Sachin Pilgaonkar,"Rohit Kumar, Dharmendra, Anjali Jathar",,1995
7123,Ab Insaf Hoga,Harish Shah,"Vikas Anand, Sahila Chaddha, Mithun Chakraborty",,1995
7124,Ahankaar,Ashim S. Samanta,"Mithun Chakraborty, Mamta Kulkarni, Mohnish Bahl, Prem Chopra",,1995
7125,Akele Hum Akele Tum,Mansoor Khan,"Aamir Khan, Manisha Koirala",Romance,1995
7126,Andolan,,"Govinda, Mamta Kulkarni, Sanjay Dutt",Comedy,1995
7127,Angrakshak,Ravi Raja,"Sunny Deol, Pooja Bhatt, Kulbhushan Kharbanda",,1995
7128,Baazi,Ashutosh Gowarikar,"Aamir Khan, Mamta Kulkarni",Action,1995
7129,Barsaat,Rajkumar Santoshi,"Bobby Deol, Twinkle Khanna",Romance,1995
7130,Bewafa Sanam,Gulshan Kumar,"Krishna Kumar, Shilpa Shirodkar, Sagar",Drama,1995
7131,Coolie No. 1,David Dhawan,"Govinda, Karishma Kapoor, Kader Khan, Shakti Kapoor",Comedy,1995
7132,Criminal,Mahesh Bhatt,"Akkineni Nagarjuna, Manisha Koirala, Ramya Krishna, Nassar, Gulshan Grover, Sharat Babu",,1995
7133,Dil Ka Doctor,Avtar Bhogal Singh,"Mahmud Babai, Nimai Bali, Shabnam Chowdhary",Comedy,1995
7134,Dilwale Dulhania Le Jayenge,Aditya Chopra,"Shahrukh Khan, Kajol, Amrish Puri, Farida Jalal, Anupam Kher",Romance,1995
7135,Diya Aur Toofan,K. Bapaiah,"Mithun Chakraborty, Madhoo, Suresh Oberoi, Mohnish Bahl, Kader Khan","Science fiction, Crime, Thriller",1995
7136,Fauji,Lawrence D'Souza,"Master Altaf, Raj Babbar, Suresh Chatwal","Action, Crime, Drama",1995
7137,Gaddaar,Deepak Sareen,"Sunil Shetty, Harish Kumar, Sonali Bendre","Action, Drama, Romance, Thriller",1995
7138,God and Gun,Esmayeel Shroff,"Raaj Kumar, Jackie Shroff, Gautami",,1995
7139,Guddu,Prem Lalwani,"Shahrukh Khan, Manisha Koirala, Deepti Naval, Mukesh Khanna, Mehmood Ali",Drama,1995
7140,Gundaraj,Guddu Dhanoa,"Ajay Devgn, Kajol",Drama,1995
7141,Guneghar,Vikram Bhatt,"Atul Agnihotri, Ishrat Ali, Pooja Bhatt",,1995
7142,Haqeeqat,Kuku Kohli,"Ajay Devgn, Tabu, Aruna Irani",Drama,1995
7143,Hathkadi,,"Shilpa Shetty, Govinda",Action,1995
7144,Hulchul,Anees Bazmee,"Vinod Khanna, Ajay Devgn, Kajol, Amrish Puri",Drama,1995
7145,Hum Dono,Shafi Inamdar,"Rishi Kapoor, Nana Patekar, Pooja Bhatt","Drama, Musical, Romance",1995
7146,Hum Sab Chor Hain,Ambrish Sangal,"Vikas Anand, Aparajita, Birbal",Musical,1995
7147,Jai Vikraanta,,Sanjay Dutt,,1995
7148,Jallaad,,"Vikas Anand, Sulabha Arya, Mithun Chakraborty","Drama, Action, Family, Comedy",1995
7149,Janam Kundli,Tariq Shah,"Jeetendra, Vinod Khanna, Reena Roy",,1995
7150,Jawab,Ajay Kashyap,"Raaj Kumar, Harish Kumar, Karishma Kapoor, Prem Chopra, Mukesh Khanna",,1995
7151,Kalyug Ke Avtaar,Sham Ralhan,"Jeetendra, Reena Roy, Madhoo","Action, Romance",1995
7152,Karan Arjun,Rakesh Roshan,"Salman Khan, Shah Rukh Khan, Kajol, Mamta Kulkarni, Raakhee Gulzar, Amrish Puri, Ranjeet",Action,1995
7153,Kartavya,Raj Kanwar,"Sanjay Kapoor, Juhi Chawla",Action,1995
7154,Kismat,Harmesh Malhotra,"Govinda, Mamta Kulkarni, Raakhee Gulzar",,1995
7155,Maidan-E-Jung,,"Akshay Kumar, Karisma Kapoor",,1995
7156,Mera Damad,,"Bhagwan Dada, Utpal Dutt, Jankidas","Comedy, Drama",1995
7157,Milan,Mahesh Bhatt,"Jackie Shroff, Manisha Koirala, Paresh Rawal","Action, Crime, Romance",1995
7158,Naajayaz,Mahesh Bhatt,"Naseeruddin Shah, Ajay Devgn, Juhi Chawla",Thriller,1995
7159,Naseem,Saeed Akhtar Mirza,"Kaifi Azmi, Mayuri Kango, Kay Kay Menon",Drama,1995
7160,Nazar Ke Samne,Jagdish A. Sharma,"Akshay Kumar, Farheen, Ekta Sohini",Family,1995
7161,Nishana,Raj N. Sippy,"Mithun Chakraborty, Rekha, Paresh Rawal","Drama, Family",1995
7162,Oh Darling! Yeh Hai India,Ketan Mehta,"Shahrukh Khan, Deepa Sahi, Jaaved Jaffrey",,1995
7163,Paandav,,"Akshay Kumar, Nandini, Prithvi",,1995
7164,Paappi Devataa,Harmesh Malhotra,"Dharmendra, Jeetendra, Jaya Pradha",,1995
7165,Param Vir Chakra,Major Ashok Kaul,"Saeed Jaffrey, Kulbhushan Kharbanda, Hema Malini",War,1995
7166,Policewala Gunda,Pappu Verma,"Dharmendra, Reena Roy, Mamta Kulkarni",,1995
7167,Prem,Satish Kaushik,"Sanjay Kapoor, Tabu, Deepak Tijori",,1995
7168,Raasaiyya,Kannan,"Prabhu Deva, Roja Selvamani, M. N. Nambiar",Drama,1995
7169,Raja,Indra Kumar,"Sanjay Kapoor, Madhuri Dixit, Paresh Rawal, Mukesh Khanna, Dalip Tahil",,1995
7170,Ram Jaane,Rajiv Mehra,"Shahrukh Khan, Juhi Chawla, Vivek Mushran",,1995
7171,Ram Shastra,Sanjay Gupta,"Jackie Shroff, Manisha Koirala, Dipti Bhatnagar",,1995
7172,Rangeela,Ram Gopal Varma,"Aamir Khan, Urmila Matondkar, Jackie Shroff",,1995
7173,Ravan Raaj: A True Story,T. Rama Rao,"Aditya Pancholi, Mithun Chakraborty, Madhoo, Sheeba, Paresh Rawal",,1995
7174,Rock Dancer,"V. Menon, Memon Roy","Govinda, Ashwani Chopra",Musical,1995
7175,Saajan Ki Baahon Mein,Jai Prakash,"Rishi Kapoor, Raveena Tandon, Sumeet Saigal, Pran","Drama, Family, Romance",1995
7176,Sabse Bada Khiladi,Umesh Mehra,"Akshay Kumar, Mamta Kulkarni, Mohnish Behl",,1995
7177,Sanjay,Shahrukh Sultan,"Ayub Khan, Sakshi Shivanand, Shakti Kapoor, Sadashiv Amrapurkar",Drama,1995
7178,Sarhad: The Border of Crime,Mahendra Shah,"Raj Babbar, Farah Naaz, Deepak Tijori","Action, Crime, Drama",1995
7179,Sauda,Ramesh Modi,"Sumeet Saigal, Neelam Kothari, Vikas Bhalla",Romance,1995
7180,Surakshaa,Raju Mavani,"Sunil Shetty, Aditya Pancholi, Saif Ali Khan, Divya Dutta, Monica Bedi",,1995
7181,Taaqat,Talat Jani,"Dharmendra, Shatrughan Sinha, Kajol, Farah Naaz, Vikas Bhalla",,1995
7182,Takkar,Bharat Rangachary,"Naseeruddin Shah, Sunil Shetty, Sonali Bendre",,1995
7183,Taqdeerwala,K. Muralimohana Rao,"Venkatesh Daggubati, Raveena Tandon, Asrani",,1995
7184,Target,Sandip Ray,"Mohan Agashe, Barun Chakraborty, Champa",Drama,1995
7185,The Don,Farogh Siddique,"Mithun Chakraborty, Sonali Bendre",,1995
7186,The Gambler,Dayal Nihalani,"Govinda, Shilpa Shetty, Aditya Pancholi, Gulshan Grover",,1995
7187,Trimurti,Mukul S. Anand,"Anil Kapoor, Jackie Shroff, Shah Rukh Khan, Priya Tendulkar, Gautami, Anjali Jathar",,1995
7188,Veergati,K.K. Singh,"Salman Khan, Atul Agnihotri, Divya Dutta",,1995
7189,Yaraana,David Dhawan,"Rishi Kapoor, Madhuri Dixit, Raj Babbar, Kader Khan, Shakti Kapoor",,1995
7190,Zamana Deewana,Ramesh Sippy,"Jeetendra, Shatrughan Sinha, Shahrukh Khan, Raveena Tandon",,1995
7191,,,,,1995
7192,Raja Hindustani,Dharmesh Darshan,,,1996
7193,Jeet,Raj Kanwar,,,1996
7194,Saajan Chale Sasural,David Dhawan,,,1996
7195,Ghatak,Rajkumar Santoshi,,,1996
7196,Aatank,Prem Lalwani,"Dharmendra, Girish Karnad, Nafisa Ali, Hema Malini, Amjad Khan, Kader Khan, Ravi Kishan",Action,1996
7197,Agni Sakshi,Partho Ghosh,"Jackie Shroff, Nana Patekar, Manisha Koirala","Thriller, Drama",1996
7198,Aisi Bhi Kya Jaldi Hai,Sachin Pilgaonkar,"Sachin Pilgaonkar, Vivek Mushran, Ashok Saraf, Shrishti Arya","Comedy, Romance",1996
7199,Ajay,Suneel Darshan,"Sunny Deol, Karishma Kapoor, Reena Roy, Sharat Saxena",Action,1996
7200,Angaara,Anil Ganguly,"Sadashiv Amrapurkar, Suresh Bhagwat, Hemant Birje",,1996
7201,Apne Dam Par,Arshad Khan,"Mithun Chakraborty, Shilpa Shirodkar",,1996
7202,Army,Jatin Thakran,"Sridevi, Danny Denzongpa, Mohnish Behl, Ronit Roy, Shahrukh Khan",Drama,1996
7203,Aur Ek Prem Kahani,Balu Mahendra,"Ramesh Aravind, Heera Rajagopal, Revathy, Sudhir Ahuja, Sushma Ahuja, Akshay Anand",,1996
7204,Aurat Aurat Aurat,K. Vishwanath,"Rekha, Vinod Mehra, Rakesh Roshan, Aruna Irani, Neeta Mehta",Drama,1996
7205,Bal Bramhachari,"Prakash Mehra, Beendhu Shukla","Puru Raaj Kumar, Karishma Kapoor, Deepak Tijori",,1996
7206,Bambai Ka Babu,Vikram Bhatt,"Saif Ali Khan, Kajol, Atul Agnihotri","Action, Romance",1996
7207,Bandish,Prakash Jha,"Juhi Chawla, Guddi Maruti, Paresh Rawal","Comedy, Drama, Romance",1996
7208,Beqabu,N. Chandra,"Sanjay Kapoor, Mamta Kulkarni, Amrish Puri","Action, Drama, Romance, Family",1996
7209,Bhairavi,Arunaraje,"Ashwini Bhave, Sridhar, Manohar Singh","Drama, Musical, Romance",1996
7210,Bhishma,Jagadish A. Sharma,"Mithun Chakraborty, Anjali Jathar, Vani Viswanath, Harish",Action,1996
7211,Chaahat,Mahesh Bhatt,"Shah Rukh Khan, Naseeruddin Shah, Anupam Kher, Pooja Bhatt, Ramya Krishna","Drama, Comedy, Thriller",1996
7212,Chall,,Jackie Shroff,,1996
7213,Chhota Sa Ghar,Kalpataru,"Asrani, Neelima Azim, Ajinkya Deo",,1996
7214,Chhote Sarkar,Manoj Agarwal,"Govinda, Shilpa Shetty",Drama,1996
7215,Daanveer,T.L.V. Prasad,"Mithun Chakraborty, Vikas Anand, Anusha, Asrani","Action, Crime, Drama",1996
7216,Daraar,Abbas-Mustan,"Rishi Kapoor, Juhi Chawla, Arbaaz Khan, Johnny Lever, Sushma Seth","Drama, Thriller",1996
7217,Dastak,Mahesh Bhatt,"Sharad Kapoor, Mukul Dev, Sushmita Sen, Manoj Bajpai",Thriller,1996
7218,Dil Tera Deewana,,"Saif Ali Khan, Twinkle Khanna","Romance, Thriller",1996
7219,Diljale,Harry Baweja,"Ajay Devgn, Sonali Bendre, Madhoo, Amrish Puri, Gulshan Grover",Action,1996
7220,Duniyaa Jhukti Hai,,"Sadashiv Amrapurkar, Jamuna, Anupam Kher",,1996
7221,Dushman Duniya Ka,Mehmood Ali,"Manzoor Ali, Laila Mehdin, Farida Jalal, Jeetendra, Shah Rukh Khan, Salman Khan",Drama,1996
7222,Dushmani: A Violent Love Story,Bunty Soorma,"Sunny Deol, Jackie Shroff, Manisha Koirala","Action, Romance",1996
7223,Ek Anari Do Khiladi,Ravi Raja,"Raveena Tandon, Balakrishna, Ramya Krishnan","Action, Romance, Drama",1996
7224,Ek Tha Raja,Dayal Nihalani,"Sunil Shetty, Saif Ali Khan, Aditya Pancholi, Neelam Kothari",Romance,1996
7225,English Babu Desi Mem,Praveen Nischol,"Shah Rukh Khan, Sonali Bendre",Romance,1996
7226,Fareb,Vikram Bhatt,"Faraaz Khan, Suman Ranganathan, Milind Gunaji",Thriller,1996
7227,Fire,Deepa Mehta,"Nandita Das, Shabana Azmi",Social,1996
7228,Ghatak,Raj Kumar Santoshi,"Sunny Deol, Meenakshi Seshadri, Amrish Puri, Om Puri, Danny Denzongpa","Action, Romance",1996
7229,Gehra Raaz,Ramesh Bedi,"Salma Agha, Raj Babbar, Jamuna",,1996
7230,Hahakaar,Sudarshan K. Rattan,"Akshay Anand, Chandni, Neelima Azim","Action, Crime, Drama",1996
7231,Halo,Santosh Sivan,"Benaf Dadachandji, Rajkumar Santoshi, Sahil Choujar",,1996
7232,Hasina Aur Nagina,Gautam Bhatia,"Sadashiv Amrapurkar, Jagdeep, Kiran Kumar",,1996
7233,Himmat,Sunil Sharma,"Sunny Deol, Shilpa Shetty, Tabu",Action,1996
7234,Himmatvar,Talat Jani,"Arun Bakshi, Gajendra Chouhan, Dharmendra",Action,1996
7235,Hukumnama,B.R. Ishara,"Amjad Khan, Mukesh Khanna, Rajat Kumar",,1996
7236,Hum Hain Khalnayak,R. Thakur,"Arjun, Rajni Bala, Kishore Anand Bhanushali",Action,1996
7237,Hum Hain Premi,Ajay Dixit,"Mahesh Anand, Tinnu Anand, Bindu",Romance,1996
7238,Is Raat Ki Subah Nahin,Sudhir Mishra,"Tara Deshpande, Akhil Mishra, Smriti Mishra",,1996
7239,Jaan,Raj Kanwar,"Ajay Devgn, Twinkle Khanna, Amrish Puri","Action, Romance",1996
7240,Jagannath,,"Sangeeta Bijlani, Mukesh Khanna, Rami Reddy",Action,1996
7241,Jay Baba Pashupatinath,Satish Kumar,"Shyam Awasthi, Rajdev Jamudhale, Sudhanshu Joshi",,1996
7242,Jeet,Raj Kanwar,"Sunny Deol, Tabu, Karisma Kapoor, Salman Khan",Drama,1996
7243,Jung,T. Rama Rao,"Ajay Devgn, Mithun Chakraborty, Sujata Mehta, Rambha",,1996
7244,Jurmana,T.L.V. Prasad,"Rambha, Ashwini Bhave, Mithun Chakraborty",Action,1996
7245,Kalinga,,Jackie Shroff,,1996
7246,Khamoshi: The Musical,Sanjay Leela Bhansali,"Salman Khan, Manisha Koirala, Nana Patekar, Seema Biswas, Helen","Social, Romance",1996
7247,Khiladiyon Ka Khiladi,Umesh Mehra,"Rekha, Akshay Kumar, Raveena Tandon",Action,1996
7248,Khilona,Deepak Pawar,"Aditya Pancholi, Monica Bedi",,1996
7249,Khoon Ki Pyasi,K.C. Handra,"Rita Bhaduri, Ramesh Goyal, Javed Khan",Horror,1996
7250,Krishna,S. Deepak,"Sunil Shetty, Karishma Kapoor","Romance, Action",1996
7251,Laalchee,Raj N. Sippy,"Anil Dhawan, Avtar Gill, Karina Grover, Pran",Drama,1996
7252,Loafer,David Dhawan,"Anil Kapoor, Juhi Chawla, Farida Jalal, Gulshan Grover",Comedy,1996
7253,Maachis,Gulzar,"Tabu, Chandrachur Singh, Om Puri","Crime, War",1996
7254,Maahir,Lawrence D'Souza,"Hema Malini, Govinda, Farha Naaz",Family,1996
7255,Mafia,,"Ishrat Ali, Somy Ali, Ali Asghar",Action,1996
7256,Majhdhaar,Ismayil Shroff,"Salman Khan, Manisha Koirala",Drama,1996
7257,Masoom,Mahesh Kothare,"Tinnu Anand, Sulabha Arya, Arun Bakshi, Ayesha Jhulka",Action,1996
7258,Megha,Mohanjee Prasad,"Shammi Kapoor, Karishma Kapoor, Rahul Roy",,1996
7259,Mr. Bechara,K. Bhagyaraj,"Sridevi, Anil Kapoor, Akkineni Nagarjuna, Anupam Kher","Comedy, Drama",1996
7260,Muqadama,K.C. Bokadia,"Vinod Khanna, Aditya Pancholi, Tanuja, Guddi Maruti",Action,1996
7261,Muqaddar,T.L.V. Prasad,"Mithun Chakraborty, Moushumi Chatterjee, Ayesha Jhulka, Simran",,1996
7262,Muthi Bhar Zameen,Tinnu Anand,"Danny Denzongpa, Poonam Dhillon, Kumar Gaurav",Action,1996
7263,Namak,Kawal Sharma,"Sanjay Dutt, Farah, Fatima Sheikh, Gulshan Grover",Action,1996
7264,Nirbhay,,"Sadashiv Amrapurkar, Sangeeta Bijlani, Mithun Chakraborty",,1996
7265,Papa Kehte Hai,Mahesh Bhatt,"Jugal Hansraj, Amin Hajee, Dinesh Hingoo",,1996
7266,Papi Gudia,Lawrence D'Souza,"Avinash Wadhavan, Karisma Kapoor, Tinnu Anand","Horror, Thriller",1996
7267,Prem Granth,Rajiv Kapoor,"Rishi Kapoor, Madhuri, Prem Chopra, Shammi Kapoor","Social, Romance",1996
7268,Raja Aur Rangeeli,K.S. Prakash Rao,Mamta Kulkarni,"Comedy, Romance",1996
7269,Raja Hindustani,Dharmesh Darshan,"Karisma Kapoor, Aamir Khan, Johnny Lever",Romance,1996
7270,Raja Ki Aayegi Baraat,Ashok Gaekwad,"Rani Mukerji, Shadaab Khan",Drama,1996
7271,Rajkumar,Pankuj Parasher,"Naseeruddin Shah, Anil Kapoor, Madhuri Dixit","Drama, Fantasy, Family, Thriller",1996
7272,Rakshak,Ashok Honda,"Sunil Shetty, Sonali Bendre, Karisma Kapoor",Action,1996
7273,Ram Aur Shyam,Raju Mawani,"Divya Dutta, Sidhant Salaria","Action, Crime, Drama",1996
7274,Rangbaaz,Kanti Shah,"Ishrat Ali, Mithun Chakraborty, Jack Gaud",Action,1996
7275,Return of Jewel Thief,Ashok Tyaagi,"Ashok Kumar, Dev Anand, Dharmendra",Crime,1996
7276,Saajan Chale Sasural,David Dhawan,"Govinda, Tabu, Karisma Kapoor, Kader Khan","Comedy, Romance",1996
7277,Sanshodhan,Govind Nihalani,"Manoj Bajpai, Vanya Joshi, Kishore Kadam",Drama,1996
7278,Sapoot,Jagdish A. Sharma,"Sunil Shetty, Akshay Kumar, Karishma Kapoor, Sonali Bendre, Kader Khan, Johnny Lever","Romance, Action, Drama",1996
7279,Sardari Begum,Shyam Benegal,"Kiron Kher, Surekha Sikri, Amrish Puri",Drama,1996
7280,Shastra,Sanjay Khanna,"Sunil Shetty, Anjali Jathar, Danny Denzongpa",Action,1996
7281,Shikaar,,"Urmila Matondkar, Jackie Shroff",,1996
7282,Shohrat,Sathish Ranjan,"Mahesh Anand, Aparajita, Asrani",,1996
7283,Smuggler,Ajay Kashyap,"Dharmendra, Reena Roy",,1996
7284,Spot Boy,Pasha P. Jung,"Akshay Anand, Babban, Raj Kiran",,1996
7285,Talaashi,,"Juhi Chawla, Jackie Shroff",,1996
7286,Tere Mere Sapne,Joy Augustine,"Chandrachur Singh, Arshad Warsi, Priya Gill, Simran, Pran","Romance, Drama",1996
7287,The Making of the Mahatma,Shyam Benegal,Rajit Kapur,Biography,1996
7288,The Square Circle,Amol Palekar,"Nirmal Pandey, Sonali Kulkarni, Faiyyaz","Drama, Music, Romance",1996
7289,Tu Chor Main Sipahi,,"Akshay Kumar, Saif Ali Khan, Tabu","Comedy, Drama",1996
7290,"Unicorn, the Garden of the Fruits",,"Yasef Caldern, Romina Barbar, Hukum Singh","Drama, Fantasy",1996
7291,Vijeta,K. Murali Mohan Rao,"Sanjay Dutt, Raveena Tandon, Paresh Rawal",Action,1996
7292,Vishwasghaat,Himanshu Brahmbhatt,"Sunil Shetty, Anjali Jathar, Anupam Kher",Action,1996
7293,Yaaron Ka Yaar,,Baba Sehgal,,1996
7294,Yash,Sharad Sharan,"Bijay Anand, Kartika Rane",Musical,1996
7295,Zordaar,Ajay Kashyap,"Govinda, Aditya Pancholi, Mandikini, Neelam Kothari",,1996
7296,,,,,1996
7297,Dil To Pagal Hai,Yash Chopra,,,1997
7298,Border,J. P. Dutta,,,1997
7299,Ishq,Indra Kumar,,,1997
7300,Pardes,Subhash Ghai,,,1997
7301,Gupt: The Hidden Truth,Rajiv Rai,,,1997
7302,Ziddi,Guddu Dhanoa,,,1997
7303,Hero No. 1,David Dhawan,,,1997
7304,Koyla,Rakesh Roshan,,,1997
7305,Judaai,Raj Kanwar,,,1997
7306,Deewana Mastana,David Dhawan,,,1997
7307,Aar Ya Paar,Ketan Mehta,"Jackie Shroff, Deepa Sahi","Romance, Crime",1997
7308,Aastha: In the Prison of Spring,Basu Bhattacharyya,"Rekha, Om Puri",,1997
7309,Aflatoon,Guddu Dhanoa,"Akshay Kumar, Urmila Matondkar",Action,1997
