,Title,Director,Cast,Genre,year
3937,Shan-e-Hind,Mohan Sinha,"Nigar Sultana, Daljeet, Kumkum",Action Costume,1960
3938,Shriman Satyawadi,S. M. Abbas,"Raj Kapoor, Shakila, Mehmood, Nasir Hussain",Social Drama,1960
3939,Singapore,Shakti Samanta,"Shammi Kapoor, Padmini, Maria Menado, Shashikala, Helen",Thriller Romance,1960
3940,Superman,"Mohammed Hussain, Anant Thakur","Jairaj, Nirupa Roy, Helen, Neeta",Action,1960
3941,Teer Aur Talwar,Mohamed Hussain,"Kamran, Kamal Mehra, Rajan Kapoor",Action Drama,1960
3942,Trunk Call,Balraj Mehta,"Shyama, Abhi Bhattacharya, Pran, Helen, Shammi",Action Drama,1960
3943,Tu Nahin Aur Sahi,Brij,"Pradeep Kumar, Kumkum, Nishi, Ratan Kumar, Minoo Mumtaz",Social Romance,1960
3944,Usne Kaha Tha,Moni Bhattacharjee,"Sunil Dutt, Nanda, Indrani Mukherjee, Rajendra Nath, Durga Khote",Romance Drama War,1960
3945,Veer Durgadas,Ramchandra Thakur,"Jairaj, Nirupa Roy, B. M. Vyas, Manhar Desai",Historical Social Drama,1960
3946,Veer Purush,Phani Mazumdar,,Children Social,1960
3947,Zalim Tera Jawab Nahin,Ramanlal Desai,"Chitra, Azad, Agha, Saroj Khan",Action,1960
3948,Zameen Ke Tare,Chandulal J. Shah,"Daisy Irani, Honey Irani, Motilal, Achala Sachdev, Anwar, Kumud Tripathi, Agha, Charlie, Bhagwan",Social Children Drama,1960
3949,Zimbo Comes To Town (Zimbo Shaher Mein),Nanubhai Bhatt,"Azad, Chitra, Shammi, Bhagwan, Nilofar",Action,1960
3950,Gunga Jumna,,"Dilip Kumar, Vyjayanthimala",,1961
3951,Junglee,,"Shammi Kapoor, Saira Banu",,1961
3952,Gharana,,"Rajendra Kumar, Raaj Kumar, Asha Parekh",,1961
3953,Aas Ka Panchhi,,"Rajendra Kumar, Vaijayantimala",,1961
3954,Jab Pyar Kisi Se Hota Hai,,"Dev Anand, Asha Parekh",,1961
3955,Sasural,,"Rajendra Kumar, B. Saroja Devi",,1961
3956,Hum Dono,,"Dev Anand, Sadhana, Nanda",,1961
3957,Kabuliwala,,Balraj Sahani,,1961
3958,Zindagi aur Khwab,,"Rajendra Kumar, Meena Kumari",,1961
3959,Shola Aur Shabnam,,"Dharmendra, Tarla Mehta",,1961
3960,Jhumroo,,"Madhubala, Kishore Kumar, Chanchal",,1961
3961,Aas Ka Panchhi,J. Om Prakash,"Rajendra Kumar, Vyjayantimala",Family Drama,1961
3962,Amar Rahe Yeh Pyar,Prabhu Dayal,"Nalini Jaywant, Rajendra Kumar, Nanda, Prabhu Dayal",Drama Family,1961
3963,Amrit Manthan,S. N. Tripathi,"Usha Kiran, Manhar Desai, Sulochana Chatterjee, Ulhas, Ratnamala, Sunder, Yashodhra Katju, Dalpat, Jeevankala, Amirbai Karnataki",Mythology,1961
3964,Aplam Chaplam,Roop K. Shorey,"I. S. Johar, Kumkum, Tiwari",Comedy,1961
3965,Apsara,B.M. Vyas,"Pradeep Kumar, Padmini, Nirupa Roy",Drama,1961
3966,Arab Ka Sitara,R.K. Rehman,"Shyam Kumar, Sheela Kashmiri, Kamran",Action,1961
3967,Bada Aadmi,Kaushal Raj,"Sheikh Mukhtar, Subiraj, Vijaya Choudhry",Action,1961
3968,Batwara,Karunesh Thakur,"Balraj Sahni, Pradeep Kumar, Jabeen, Shashikala",Family Drama,1961
3969,Bhabhi Ki Chudiyan,Sadashiv Rao Kavi,"Meena Kumari, Balraj Sahni",Family Drama,1961
3970,Boy Friend,Naresh Saigal,"Shammi Kapoor, Dharmendra, Madhubala",Romance,1961
3971,Char Diwari,Krishan Chopra,"Shashi Kapoor, Nanda, Manmohan Krishna",Romance Family,1961
3972,Chhatrapati Shivaji Maharaj,Ram Narayan Gabale,,,1961
3973,Chhaya,Hrishikesh Mukherjee,"Sunil Dutt, Asha Parekh",,1961
3974,Chhote Nawab,S.A. Akbar,"Mehmood, Ameeta, Minoo Mumtaz, Johnny Walker, R.D. Burman",Comedy Romance,1961
3975,Dark Street,Naresh Saigal,"Ashok Kumar, K.N. Singh, Amirbai Karnataki, Nishi",Action,1961
3976,Dharmputra,Yash Chopra,"Shashi Kapoor, Mala Sinha, Rehman, Nirupa Roy, Indrani Mukherjee",Social Family Drama,1961
3977,Do Bhai,Vishram Bedekar,"Shakila, Helen, Abhi Bhattacharya, Om Prakash, Daisy Irani",Family,1961
3978,Flat No. 9,Ramesh Sharma,"Ashok Kumar, Sayeeda Khan, Helen",,1961
3979,Gharana,S.S. Vasan,"Rajendra Kumar, Asha Parekh, Lalita Pawar",Family Drama,1961
3980,Gunga Jumna,Nitin Bose,"Dilip Kumar, Vyjayantimala, Nazir Khan",Drama Action,1961
3981,Hamari Yaad Aayegi,Kidar Sharma,"Tanuja, Ashok Sharma",Romance Drama,1961
3982,Hum Dono,Amarjeet,"Dev Anand, Nanda, Sadhna",Drama Family Romance War,1961
3983,Hum Matwaale Naujawaan,L.R. Asthana,"Shekhar, Sayeeda Khan, Jeevan, Agha",Drama Family,1961
3984,Jab Pyar Kisise Hota Hai,Nasir Hussain,"Dev Anand, Asha Parekh, Pran",Romance,1961
3985,Jadoo Nagri,Radhakant,"Ranjan, Vijaya Choudhary, Jeevan",Fantasy,1961
3986,Jai Bhawani,Dhirubhai Desai,"Jayshree Gadkar, Manhar Desai, Lata Sinha, Veena",Mythology,1961
3987,Jai Chittor,Jaswant Jhaveri,"Nirupa Roy, Jairaj, Bipin Gupta",Drama History,1961
3988,Jhumroo,Shanker Mukherjee,"Kishore Kumar, Madhubala, Anoop Kumar, Chanchal",Romance Drama,1961
3989,Junglee,Subodh Mukherjee,"Shammi Kapoor, Saira Banu, Anoop Kumar, Lalita Pawar, Azra",Romance,1961
3990,Kabuliwala,Hemen Gupta,"Balraj Sahni, Usha Kiran, Sonu, Baby Farida",Drama,1961
3991,Karorepati,Mohan Sehgal,"Kishore Kumar, Kumkum, Anoop Kumar, Shashikala","Comedy, Crime",1961
3992,Kanch Ki Gudiya,H. S. Rawail,"Manoj Kumar, Sayeeda Khan, Tarun Bose, Shubha Khote",Drama Family,1961
3993,Khiladi,B.J. Patel,"Ranjan, Jabeen, Shammi, Sunder, Tiwari",Action,1961
3994,Madan Manjri,J. Trivedi,"Manhar Desai, Ajit, Nalini Chonker",Fantasy,1961
3995,Mahavat[2],M. A. Thirumugam,"Udaykumar, B. Sarojadevi",Drama,1961
3996,Main Aur Mera Bhai,Dharam Kumar,"Ajit, Ameeta, Lalita Pawar, Helen",Family Drama,1961
3997,Matlabi Duniya,Radhakant M Thakur,"Anant Kumar, Dhumal, Asha",Social,1961
3998,Maya,D.D. Kashyap,"Dev Anand, Mala Sinha",Drama Crime Romance,1961
3999,Memdidi,Hrishikesh Mukherjee,"Tanuja, Keysi Mehra, Lalita Pawar, Jayant, David",Drama,1961
4000,Mera Suhaag,Hunsur Krishnamurthy,"Nazima, Kanta Rao",Family Drama,1961
4001,Modern Girl,R. Bhattacharya,"Pradeep Kumar, Sayeeda Khan, Madan Puri, Iftekhar, Helen",Family Drama,1961
4002,Mr. India,G.P. Sippy,"Geeta Bali, I. S. Johar, Helen, Feroz Khan","Comedy, Crime",1961
4003,Murad,Nari Ghadiali,"Chitra, Asgar, Manju",,1961
4004,Nazrana,Sridhar,"Raj Kapoor, Vyjayantimala Gemini Ganesan, Usha Kiran",Family Drama,1961
4005,Oomar Qaid,Aspi Irani,"Sheikh Mukhtiar, Sudhir, Nazima, Mukri, Helen, Sulochana.",,1961
4006,Opera House,P.L. Santoshi,"Ajit, B. Saroja Devi, Lalita Pawar",Crime Thriller Romance,1961
4007,Passport,Pramod Chakravorty,"Pradeep Kumar, Madhubala, K.N. Singh",Thriller,1961
4008,Pyaase Panchhi,Harsukh Jagneshwar Bhatt,"Mehmood, Ameeta, Jeevan, David","Romance, Comedy",1961
4009,Pyar Ka Sagar,Devendra Goel,"Rajendra Kumar, Meena Kumari, Madan Puri","Romance, Drama",1961
4010,Pyaar Ki Dastan,P.L. Santoshi,"Ameeta, Sudesh Kumar, Shubha Khote, Mohan Choti, Helen",Romance,1961
4011,Pyaar Ki Pyaas,Mahesh Kaul,"Honey Irani, Shrikant, Nishi, Manmohan Krishna",Drama Family,1961
4012,Ram Lila,Chandrakant,"Abhi Bhattacharya, Jayshree T, Shahu Modak, Leela Chitnis, Tiwari, Anil Kumar, Tun Tun",Mythological,1961
4013,Razia Sultana,Devendra Goel,"Nirupa Roy, Kamran, Jairaj, Agha, Madhumati",Historical Romance,1961
4014,Reshmi Rumal,Harsukh Jagneshwar Bhatt,"Manoj Kumar, Shakeela, Kamal Kapoor, K.N. Singh, Helen",Romance,1961
4015,Roop Ki Rani Choron Ka Raja,Harnam Singh Rawail,"Dev Anand, Waheeda Rehman, Jeevan, Sunder",Romance,1961
4016,Saaya,Shreeram,"Nasir Khan, Nigar Sultana, Helen, Chitra, Madan Puri",Family Drama,1961
4017,Salaam Memsaab,Kalpataru,"Kumkum, Subbi Raj, K.N. Singh","Thriller, Action, Romance",1961
4018,Sampoorna Ramayana,Babubhai Mistry,"Mahipal, Anita Guha, Achala Sachdev, Lalita Pawar, Badri Prasad",Mythological,1961
4019,Sanjog,Pramod Chakravorty,"Pradeep Kumar, Anita Guha, Shubha Khote, Om Prakash",Drama Social Family,1961
4020,Sapera,B.J. Patel,"Ranjan, Jeevan Kala, Tiwari",,1961
4021,Sapne Suhane,Kedar Kapoor,"Balraj Sahni, Geeta Bali, Chandrashekhar, Kamini Kadam",Romance Drama,1961
4022,Sara Jahan Hamara,Prakash Chabra,"Premnath, Shyama, Jankidas, Azra",Crime Action Drama,1961
4023,Sasural,T. Prakash Rao,"Rajendra Kumar, B. Saroja Devi, Mehmood, Shobha Khote, Dhumal",Family Drama,1961
4024,Sati Renuka,Prakash Rao,"Jamuna, G. Varalaxmi",Mythological,1961
4025,Saugandh,G.K. Ramu,"Anjali Devi, Gemini Ganesan, Kamla Laxman, M.N. Nambiar.",Drama,1961
4026,Savitri,Phani Majumdar,,Children's Film,1961
4027,Senapati,Kedar Kapoor,"Prithviraj Kapoor, Nalini Jaywant",Costume Drama,1961
4028,Shahi Farman,K. Anand,"Krishna Kumari, Kamran",Action,1961
4029,Shama,Lekhraj Bhakri,"Nimmi, Suraiya, Vijay Dutt",Social Drama,1961
4030,Shola Aur Shabnam,Ramesh Saigal,"Dharmendra, Tarla",Romance Drama,1961
4031,Shola Jo Bhadke,Bhagwan,"KumKum, Purnima, Suresh, Anwar, Bhagwan, Helen",Musical,1961
4032,Stree,V. Shantaram,"V. Shantaram, Sandhya, Rajshree",Drama,1961
4033,Suhag Sindoor,Krishanan Panju,"Balraj Sahni, Mala Sinha, Manoj Kumar",Family Social Drama,1961
4034,Tanhai,Ram Narayan Gabale,"Karan Dewan, Usha Kiran, Purnima, Jagirdar",,1961
4035,Teen Kanya: Tales of Three girls (Bengali),Satyajit Ray,"Chandana Banerjee, Anil Chatterjee, Kali Banerjee, Kumar Roy, Soumitra Chatterjee, Aparna Sen, Gita Dey",Anthology film,1961
4036,Teen Ustad,Nanabhai Bhatt,"Suresh, Ameeta, Shammi, Honey Irani",Action Crime Drama,1961
4037,Tel Malish Boot Polish,Romey Dey,"Sheikh Mukhtar, KumKum, Chandrashekhar, Madan Puri",Action Drama,1961
4038,Wanted,Nisar Ahmad Ansari,"Vijay Kumar, Sayeeda Khan",Action,1961
4039,Warrant,Kedar Kapoor,"Ashok Kumar, Raaj Kumar, Shakeela, Dhumal",Action,1961
4040,Wazir-e-Azam,R. S. Rahi,"Chand Usmani, Nadira, Indira Billi, Bhagwan, Helen","Adventure, Costume Drama",1961
4041,Zabak,Homi Wadia,"Mahipal, Shyama, Chitra",Costume Drama,1961
4042,Zalim Jadugar,Sultan,"Hercules, Neeta, Rajrani","Fantasy, Action",1961
4043,Zamana Badal Gaya,Jayant Desai,"Charlie, Chand Usmani, Naina, Iftekhar, Bhagwan, Helen",Social,1961
4044,Zindagi aur Khwab,S. Banerjee,"Meena Kumari, Rajendra Kumar, Jayant, Agha, Naaz, Pratima Devi, Jeevankala",Romantic melodrama,1961
4045,Bees Saal Baad,,"Biswajeet, Waheeda Rehman",,1962
4046,Ek Musafir Ek Haseena,,"Joy Mukherjee, Sadhana",,1962
4047,Professor,,"Shammi Kapoor, Kalpana",,1962
4048,Hariyali Aur Raasta,,"Mala Sinha, Manoj Kumar",,1962
4049,Asli-Naqli,,"Dev Anand, Sadhana",,1962
4050,Dil Tera Diwana,,"Mala Sinha, Shammi Kapoor",,1962
4051,Anpadh,,"Mala Sinha, Dharmendra",,1962
4052,Aarti,,"Ashok Kumar, Meena Kumari, Pradeep Kumar",,1962
4053,China Town,,"Shammi Kapoor, Shakila",,1962
4054,Sangeet Samrat Tansen,,"Bharat Bhushan, Anita Guha",,1962
4055,Son of India,,"Sajid Khan, Kumkum, Kanhaiyalal",,1962
4056,Half Ticket,,"Madhubala, Kishore Kumar, Pran",,1962
4057,Aalha Udal,Jaswant Jhaveri,"P. Jairaj, Nirupa Roy, Sabita Chatterjee, Dilip Raj, Jeevan, Sapru, Ishwarlal","Historical fiction, Fantasy",1962
4058,Aankh Michouli,Ravindra Dave,"Shekhar, Mala Sinha, Jeevan, S. Nasir, Leela Mishra, Jagdish Raj, Naazi",Crime Thriller,1962
4059,Aarti,Phani Mazumdar,"Ashok Kumar, Meena Kumari, Pradeep Kumar, Shashikala, Rajendranath, Peace Kanwal, Ramesh Deo, Chandrima Bhaduri, Keshto Mukherjee",Family Drama,1962
4060,Aashiq,Hrishikesh Mukherjee,"Raj Kapoor, Nanda, Padmini, Keshto Mukherjee and Leela Chitnis",Musical melodrama,1962
4061,Anpadh,,"Dharmendra, Mala Sinha, Balraj Sahni, Bindu, Shashikala, Aruna Irani, Dhumal, Nazir Hussain",Social Family Drama,1962
4062,Apna Banake Dekho,Jagdish Nirula,"Manoj Kumar, Asha Parekh, Sajjan, Sunder, Nazir Hussain, Mohan Choti",Romance,1962
4063,Asli-Naqli,Hrishikesh Mukherjee,"Dev Anand, Sadhana, Anwar Hussain, Leela Chitnis, Sandhya Roy and Keshto Mukherjee",Romantic Drama,1962
4064,Baaje Ghungroo,Shivraj Shrivastav,"Manhar Desai, Nalini Chonkar, Sheela Kashmiri, Leela Mishra, Nazir Kashmiri, Jagdish Kanwal",Fantasy Drama,1962
4065,Baat Ek Raat Ki,Shankar Mukherjee,"Dev Anand, Waheeda Rehman, Chandrashekhar, Johnny Walker, Sabita Chatterjee, Asit Sen, Ulhas, Jagdish Sethi",Romance Thriller,1962
4066,Baghdad Ki Raaten,Nanabhai Bhatt,"Mahipal, Shakila, Bhagwan, Ishwarlal, Leela Mishra, Ratanmala",Action Fantasy,1962
4067,Banarsi Thug,Lekhraj Bhakri,"Manoj Kumar, Vijaya Chaudhary, I. S. Johar, Lalita Choudhary, Radhakishan, Malika, Madhumati","Romantic comedy, Drama",1962
4068,Banke Sanwaria,Danpat Rai,"P. Jairaj, Chand Usmani, Achala Sachdev, Rajan Kapoor, Jeevankala, Mirajkar",Action,1962
4069,Bapu Ne Kaha Tha,Vijay Bhatt,"Jankidas, Neena, Manju, Sandeep, Kesari, Jugal Kishore, Majnu, Nana Palsikar",Children,1962
4070,Bees Saal Baad,Biren Nag,"Waheeda Rehman, Biswajeet, Manmohan Krishna, Madan Puri, Sajjan, Lata Sinha",Romantic Thriller,1962
4071,Bombay Ka Chor,S. D. Narang,"Kishore Kumar, Mala Sinha, Jagdish Raj, Amar, Iftekhar, Honey Irani, Helen, Pratima Devi","Romance, Crime",1962
4072,Bezubaan,Ram Kamlani,"Ashok Kumar, Nirupa Roy, David, Shammi, Helen, Anoop Kumar, Babloo",Family Drama,1962
4073,Bijli Chamke Jamna Paar,Jaswant Jhaveri,"P. Jairaj, Nirupa Roy, Tabassum, Dhumal, Raj Kishore",Drama,1962
4074,Burmah Road,Tara Harish,"Ashok Kumar, Sheikh Mukhtar, Kumkum, Vijaya Choudhary, Moti Sagar, Mohan Choti, Uma Dutt, Murad, Jeevankala, Ajit",,1962
4075,China Town,Shakti Samanta,"Shammi Kapoor, Shakila, Helen, Madan Puri, Jeevankala, Mridula, S. N. Banerjee, Kanu Roy",Romantic thriller,1962
4076,Deccan Queen,Akkoo,"Samar Roy, Krishna Kumari, Sheela Kashmiri, Indira Bansal, Maqbul, Habib",Action,1962
4077,Dil Tera Diwana,B. R. Panthulu,"Shammi Kapoor, Mala Sinha, Mehmood, Shobha Khote, Pran, Om Prakash, Manmohan Krishna, Mohan Choti, Ulhas, Mumtaz Begum",Romantic Drama,1962
4078,Dr. Vidya,Rajendra Bhatia,"Vyjayantimala, Manoj Kumar, Madan Puri, Prem Chopra, Mumtaz, Sunder, Helen, Nazir Hussain",Social family Drama,1962
4079,Durga Pooja,B. K. Adarsh,"Anant Kumar, Jaymala, B M Vyas, Naazi, Hiralal",Devotional,1962
4080,Dilli Ka Dada,R. S. Tara,"Sheikh Mukhtar, Shekhar, Sahira, Mukri, Nishi, Kumar",Action,1962
4081,Ek Musafir Ek Hasina,Raj Khosla,"Sadhana, Joy Mukherjee, Malika, Rajendranath, Kamal Kapoor, Dhumal, Jagdish Raj",Romantic Drama,1962
4082,Gangu,Pramod Chakravorty,"Sheikh Mukhtar, Naaz, Chandrashekhar, Sulochana, Madan Puri, Mohan Choti",Action,1962
4083,Girls' Hostel,Ravindra Dave,"Ajit Khan, Nalini Jaywant, Johnny Walker, Shashi Raj, Geetanjali, Chand Burque",Romantic Drama,1962
4084,Gyarah Hazaar Ladkiyan,K. A. Abbas,"Bharat Bhushan, Mala Sinha, David, Mukri, Murad, Nadira, Helen, Baby Farida",Social Romantic drama,1962
4085,Half Ticket,B. Kalidas,"Kishore Kumar, Madhubala, Pran, Shammi, Tun Tun, Manorama, Helen",Romantic comedy,1962
4086,Hame Bhi Jeene Do,M. G. Ramachandran,"M. G. Ramachandran, B. Saroja Devi, P. Bhanumati",,1962
4087,Hamen Khelne Do,R. K. Sharma,"Chaman Puri, Neena Chopra, Dubey, Master Raja",Children,1962
4088,Hariyali Aur Rasta,Vijay Bhatt,"Manoj Kumar, Mala Sinha, Om Prakash, Shashikala, Manmohan Krishna, Jagdeep, Surendra, Helen",Romantic Family Drama,1962
4089,Hawa Mahal,B J Patel,"Rajan, Helen, Bela Bose, Sulochana, Jeevan, Tiwari, Murad",Fantasy,1962
4090,Hong Kong,Pachhi,"Ashok Kumar, B. Saroja Devi, K. N. Singh, Om Prakash, Helen, Babu Rao, King Kong (wrestler)",Action Thriller,1962
4091,Isi Ka Naam Duniya Hai,Shakti Samanta,"Ashok Kumar, Mehmood Shayama, Om Prakash, Sahira, K. N. Singh, Helen, Nazir Hussain",Socia Family drama,1962
4092,Jadoo Mahal,Aakkoo,"Helen, Azad, Hiralal, Ram Kumar, Krishna Kumari",Fantasy,1962
4093,Jai Ho Mohabbat Ki,Vithaldas Panchotia,"Paresh Banerjee, Meera, Mirza Musharraf, Najma, Heera Sawant, Helen, V Panchotia, Sulbha Kataria",Comedy Drama,1962
4094,Jadugar Daku,Chandrakant,"P. Jairaj, Jabeen, Madhumalti, Helen, Maruti, Bela Bose, Tun Tun",Fantasy,1962
4095,Jhoola,K. Shankar,"Sunil Dutt, Vyjayantimala, Pran, Rajendranath, Sulochana, Tun Tun, Manmohan Krishna, Raj Mehra",Family Drama,1962
4096,Kailashpati,Dhirubhai Desai,"Mahesh Desai, Sumitra Devi, Padmarani, Niranajan Sharma, Jeevan",Mythological,1962
4097,Kala Chashma,K. Vinod,"Manju, Amarnath, Madan Puri, Maruti, Sheela Kashmiri, Jeevankala, Sheikh",Action Crime,1962
4098,Kala Samundar,R. P. Ashk,"P. Jairaj, Chitra, Maruti, Hiralal, Tun Tun, Radhika",Action,1962
4099,King Kong,Babubhai Mistri,"Dara Singh, Kumkum, Randhawa, King Kong (wrestler), Uma Dutt, Leela Mishra, Chandrashekhar, Kamal Mehra",Action,1962
4100,Maa Beta,Lekhraj Bhakri,"Manoj Kumar, Ameeta, Sheila Ramani, I. S. Johar, Nirupa Roy, Lalita Pawar, Tarun Bose, Manmohan Krishna, Manorama, Leela Mishra",Family Drama,1962
4101,Madam Zapatta,Ram Rasila,"Azad, Mehroo, Bhagwan, Heera, Sawant, Ram Rasila, Gulab",Action,1962
4102,Madam Zorro,Aakkoo,"Azad, Nadira, Helen, Bhagwan, Sheikh, Tiwari",Action,1962
4103,Main Chup Rahungi,A. Bhim Singh,"Sunil Dutt, Meena Kumari, Babloo, Jagirdar, Nana Palsikar, Mohan Choti, Helen, Raj Mehra",Social Family Drama,1962
4104,Main Shadi Karne Chala,Roop K. Shorey,"I. S. Johar, Sayeeda Khan, Tabassum, Praveen Choudhary, Mumtaz, Malika, Durga Khote, Feroze Khan, Rajendranath",Comedy,1962
4105,Mall Road,Viren Dablish,"Chandrashekhar, Sangeeta, Kesari, Bela Bose, Radheshyam",Action Romance,1962
4106,Man-Mauji,"R. Krishnan, S. Panju","Kishore Kumar, Sadhana, Pran, Achala Sachdev, Naaz, Om Prakash, Mukri, Leela Chitnis",Family Drama,1962
4107,Maya Jaal,Babubhai Mistry,"Ranjan, Chitra, Manhar Desai, Krishna Kumari, Radhika",Fantasy,1962
4108,Mehndi Lagi Mere Hath,Suraj Prakash,"Shashi Kapoor, Nanda, Ashok Kumar, Achla Sachdev, Mridula","Romance, Family Drama",1962
4109,Meri Bahen,A S A Swami,"M G Ramachandran, Padmini, Raja Sulochana, Kumud Tripathi",Family Drama,1962
4110,Naag Devta,Shantilal Soni,"Mahipal, Anjali Devi, Shashikala, B. M. Vyas, Leela Chitnis, Niranajan Sharma",Fantasy,1962
4111,Nakli Nawab,Tara Harish,"Ashok Kumar, Manoj Kumar, Shakila, K. N. Singh, Kamal Kapoor, Indira Billi, Shammi",Family Drama,1962
4112,Naughty Boy,Shakti Samanta,"Kishore Kumar, Kalpana, Sulochana, Om Prakash, Madan Puri, Sunder",Romantic comedy,1962
4113,Neeli Aankhen,Ved Mohan,"Ajit, Shakeela, Helen, Johnny Walker, Tiwari, Tun Tun, Raj Mehra, Shetty","Romance, Thriller",1962
4114,Pathan,Attaulla Khan,"Premnath, Mumtaz, Achala Sachdev, Iftekhar, Bhagwan",Action,1962
4115,Prempatra,Bimal Roy,"Shashi Kapoor, Sadhana, Chand Usmani, Rajendra Nath, Seema Deo, Parveen Choudhary, Satyen Kappu",Social Romance Drama,1962
4116,Private Secretary,Chander,"Ashok Kumar, Jayshree Gadkar, Raja Gowswami, Umakant, Mohan Choti, Purnima, N. A. Ansari",Action Drama,1962
4117,Professor,Lekh Tandon,"Shammi Kapoor, Kalpana, Salim, Parveen Choudhary, Lalita Pawar, Iftekhar, Tun Tun, Pratima Devi",Romantic comedy,1962
4118,Raaz Ki Baat,Bolton Ci Nagi,"Sujit Kumar, Simi Garewal, Abhi Bhattacharya, Shyama, Sulochana, K. N. Singh, Agha, Mohan Choti",Thriller,1962
4119,Raju Aur Gangaram,Ezra Mir,"Mridula, Abhimanyu Sharma",Children,1962
4120,Rakhi,A. Bhimsen,"Ashok Kumar, Waheeda Rehman, Pradeep Kumar, Ameeta, Mehmood, Mohan Choti",Family Drama,1962
4121,Rashtraveer Shivaji,R. C. Talwar,"Shyam Kumar, Ratnamala, Bela Bose, Heera Sawant, Rajrani, Radheshyam, Fazal Khan",Historical,1962
4122,Reporter Raju,Dwarka Khosla,"Feroz Khan, Chitra, Indira Billi, Sulochana Chatterjee, Manorama, B. M. Vyas, Ratanmala, Manju","Action, Crime",1962
4123,Rocket Girl,Nanabhai Bhatt,"Naaz, Bhagwan, Nilofer, Shammi, Soodesh Kumar, Kanchan, Brahm Bhardawaj, Jagdish Raj",Action Fantasy,1962
4124,Rooplekha,Mohammed Hussain,"Mahipal, Vijaya Chaudhary, Krishna Kumari, Raj Adib, Shyam Kumar, Sunder, Jeevankala, Amar",Fantasy,1962
4125,Rungoli,Amar Kumar,"Kishore Kumar, Vyjayantimala, Jeevan, Durga Khote, Nazir Hussain, Sadhana Roychowdhary, Iftekhar, Dhumal, Brahm Bhardawaj",Romantic Drama,1962
4126,Sachche Moti,Omi Bedi,"Jabeen, Suresh, Johnny Walker, Jeevan, Sulochana, Manmohan Krishna, Shammi",Crime Drama Romance,1962
4127,Sahib Bibi Aur Ghulam,Abrar Alvi,"Meena Kumari, Guru Dutt, Waheeda Rehman, Rehman, Nazir Hussain, Dhumal, Harindranath Chattopadhyay, Pratima Devi, Jawahar Kaul, Minu Mumtaz",Drama,1962
4128,Sakhi Robin,B. J. Patel,"Ranjan, Shalini, Babu Raje, Nilofar, Rajan Kapoor",Action,1962
4129,Sangeet Samrat Tansen,S. N. Tripathi,"Bharat Bhushan, Anita Guha, Sabita Chatterjee, David, Sapru, Kumar, Mukri",Biopic Historical Drama,1962
4130,Sautela Bhai,Mahesh Kaul,"Guru Dutt, Pranati (Pranoti Ghosh), Raj Kumar, Kanhaiyalal, Bipin Gupta, Asit Sen, S. N. Banerjee, Bela Bose, Honey Irani, Sarosh Irani",Family Drama,1962
4131,Shaadi,"R. Krishnan, S. Panju","Saira Banu, Manoj Kumar, Dharmendra, Balraj Sahni, Om Prakash, Kalpana, Sulochana",Family Drama,1962
4132,Sher Khan,Radhakant,"Kamaljit, Kumkum, Jayant, Veena, Sunder, Ulhas, Tabassum, Hiralal",Action,1962
4133,Shiv Parvati,S. N. Tripathi,"Trilok Kapoor, Ragini, Vandana, Jeevan, Praveen Paul, Nayampally",,1962
4134,Shree Ganesh,S. S. Dharwadkar,"Mahipal, Sahira, Indira Billi, Krishna Kumari, Jeevankala, Uma Dutt, Tiwari",Religious,1962
4135,Son of India,Mehboob Khan,"Kumkum, Kanwaljeet, Sajid Khan, Jayant, Kanhaiyalal, Mukri, Simi Garewal, Tun Tun, Kumar, Lilian",Family Melodrama,1962
4136,Soorat Aur Seerat,Rajnish Bahl,"Dharmendra, Nutan, K. N. Singh, Sulochana, Honey Irani, Asit Sen, Iftekhar, Badri Prasad, Leela Mishra",Drama,1962
4137,Tilasmi Duniya,A. Karim,"Daljit, Krishna Kumari, Mohan Sherry, Indira Billi, Shyam Kumar, Sarla Devi, Jillani",Fantasy Action,1962
4138,Toofani Tarzan,A. R. Zamindar,"Azad, Shanta Kumari, Shyam Kumar, Jeevankala, Tun Tun, Aruna, Lata Arora",Action Adventure,1962
4139,Tower House,N. A. Ansari,"Ajit Khan, Shakila, N. A. Ansari",Thriller,1962
4140,Vallah Kya Baat Hai,Hari Walia,"Shammi Kapoor, Bina Rai, Nishi, Mumtaz, K. N. Singh, Tun Tun, Maruti, Mohan Choti",Romantic Drama,1962
4141,Zindagi Aur Hum,Anand Kumar,"Nalini Jaywant, Dinesh, Chand Usmani, David, Mukri, Leela Mishra",Drama,1962
4142,Mere Mehboob,,"Rajendra Kumar, Sadhana, Ameeta",,1963
4143,Taj Mahal,,"Pradeep Kumar, Bina Rai",,1963
4144,Phir Wohi Dil Laya Hoon,,"Joy Mukherjee, Asha Parekh",,1963
4145,Gumrah,,"Mala Sinha, Ashok Kumar, Sunil Dutt",,1963
4146,Dil Ek Mandir,,"Rajendra Kumar, Meena Kumari, Raaj Kumar",,1963
4147,Tere Ghar Ke Samne,,"Dev Anand, Nutan",,1963
4148,Shikari,,"Ajit, Ragini",,1963
4149,Mujhe Jeene Do,,"Sunil Dutt, Waheeda Rehman",,1963
4150,Gehra Daag,,"Mala Sinha, Rajendra Kumar",,1963
4151,Bandini,,"Ashok Kumar, Nutan",,1963
4152,Aaj Aur Kal,Vasant Joglekar,"Sunil Dutt, Nanda, Ashok Kumar, Raaj Kumar, Tanuja, Soodesh Kumar, Deven Verma",Family Drama,1963
4153,Akela,Jay Bee,"Balraj Sahni, Sadhana Roychowdhury, Lalita Pawar, Sulochana, Dhumal, Murad, Daisy Irani, Honey Irani",Crime Drama,1963
4154,Akeli Mat Jaiyo,Nandlal Jashwantlal,"Meena Kumari, Rajendra Kumar, Agha, Minu Mumtaz, Leela Mishra",Romance Drama,1963
4155,Awara Abdulla,Tara Harish,"Dara Singh, Parveen Choudhary, Helen, Chandrashekhar, Bhagwan",Action,1963
4156,Bachpan,Nazar,"Salim Khan, Menka Irani, Daisy Irani, Jeevan, Manorama, David, Bhudo Advani",Social Drama,1963
4157,Bahurani,T. Prakash Rao,"Guru Dutt, Mala Sinha, Feroz Khan, Shyama, Lalita Pawar, Agha",Family Drama,1963
4158,Band Master,Ravindra Dave,"Jagdeep, Azra, Ravikant, Lalita Pawar, Rajan",Drama Family Romance,1963
4159,Bandini,Bimal Roy,"Dharmendra, Nutan, Ashok Kumar, Raja Paranjpe, Tarun Bose, Asit Sen, Sulochana",Drama,1963
4160,Been Ka Jadoo,N. Rajesh,"Mahipal, Helen, Kammo, Tiwari, Mohan Choti, Ulhas",Fantasy,1963
4161,Begaana,Sadashiv Rao Kavi,"Dharmendra, Supriya Chowdhury, Agha, Sailesh Kumar, Tarun Bose, Madhavi, Daisy Irani, Manorama",Romance Drama,1963
4162,Bharosa,K. Shankar,"Guru Dutt, Asha Parekh, Sudesh Kumar, Om Prakash, Shobha Khote, Mehmood, Lalita Pawar, Nana Palsikar, Sulochana",Family Drama Romance,1963
4163,Bhootnath,Nanabhai Bhatt,"Ranjan, Vijaya Chaudhary, Rajan Haksar, Mohan Choti, Ulhas, Jeevankala","Costume, Action",1963
4164,Bin Badal Barsaat (1963 film),Jyoti Swaroop,"Biswajeet, Asha Parekh, Nishi, Mehmood, Moni Chatterjee, Padma Chavan",Thriller Drama,1963
4165,Bluff Master,Manmohan Desai,"Shammi Kapoor, Saira Banu, Pran, Lalita Pawar, Mohan Choti, Tun Tun, Niranjan Sharma, Rashid Khan",Romance Comedy Drama,1963
4166,Captain Sheroo,Dharam Kumar,"P. Jairaj, Helen, Maruti, Niranjanjan Sharma, Tun Tun, Padma Rani",Action,1963
4167,Chandrasekhar Azad,Jagdish Gautam,"P. Jairaj, Nirupa Roy, Indira Billi, Manju, Leela Mishra",Historical Biopic,1963
4168,Cobra Girl,Nanabhai Bhatt,"Mahipal, Ragini, Tiwari, Sunder, Manorama, Mariya",Fantasy,1963
4169,Commercial Pilot Officer,O. P. Dutta,"Sohan Kapila, Shyama, Shashikala",Action Thriller,1963
4170,Daanveer Karan,B. R. Panthulu,"Shivaji Ganesan, N T Rama Rao, Savitri",Mythology,1963
4171,Deepak,Harsukh Bhatt,"Sulochana Chatterjee, Master Anwar, Maruti Rao, Chaman Puri, Bhartendu, Dwarkadas",Children,1963
4172,Dekha Pyar Tumhara,Kalpataru,"Bhagwan, Naaz, Subiraj, Achala Sachdev, Helen, Madan Puri",Romantic Drama,1963
4173,Dev Kanya,S. N. Tripathi,"Mahipal, Anita Guha, Krishna Kumari, Mukri, B. M. Vyas, Babu Raje",Fantasy,1963
4174,Dil Ek Mandir,C. V. Sridhar,"Rajendra Kumar, Meena Kumari, Raaj Kumar, Mehmood, Shobha Khote, Achala Sachdev",Romantic triangle,1963
4175,Dil Hi To Hai (1963 film),"C. L. Rawal, Pyare Lal Santoshi","Raj Kapoor, Nutan, Pran, Nazir Hussain, Leela Chitnis, Sabita Chatterjee, Manorama, Agha",Romance,1963
4176,Ek Dil Sao Afsane,R.C. Talwar,"Raj Kapoor, Waheeda Rehman, Lalita Pawar, Sadhna Choudhary, Sulochana, Raj Kishore, Jagdish Raj, Tun Tun","Family, Romance Drama",1963
4177,Ek Raaz,Shakti Samanta,"Kishore Kumar, Jamuna, Pran, Lalita Pawar, Tun Tun, Mumtaz, Agha",Social Family Drama,1963
4178,Ek Tha Alibaba,Harbans,"Dara Singh, Nishi, Helen, Naaz, Tiwari, Hiralal, Ram Singh",Fantasy,1963
4179,Faulad,Mohammed Hussain,"Dara Singh, Mumtaz, Randhawa, Shyam Kumar, Kamran, Minu Mumtaz, Kamal Mehra",Action,1963
4180,Gehra Daag,O. P. Ralhan,"Mala Sinha, Rajendra Kumar, Usha Kiran, Madan Puri, Mumtaz, Tun Tun, Manmohan Krishna, Lalita Pawar, Sunder",Romance Crime Drama,1963
4181,Ghar Basake Dekho,Kishore Sahu,"Manoj Kumar, Rajshree, Savitri, Mehmood, Shyama, Johnny Walker, Lalita Pawar",Family Drama,1963
4182,Godaan,Trilok Jetley,"Raaj Kumar, Kamini Kaushal, Manhar Desai, Shashikala, Madan Puri, Shobha Khote, Mehmood, Tun Tun",Family Drama,1963
